title,category,content
"与恐惧进行的游戏","文化","　　　内容提要： 《奥尔拉》被公认为莫泊桑创作的最优秀的玄怪小说，本文一方面通过其两个版本的对比，着重探讨了第二版的叙述技巧，侧面揭示出作家进行改写的原因；另一方面结合玄怪故事的标准，分析第二版的《奥尔拉》相应的叙述策略和文体特点，试图说明第二版何以成为玄怪小说的经典。\n　　关键词： 莫泊桑 《奥尔拉》 玄怪文学 恐惧\n　　\n　　莫泊桑素以创作短篇小说著称，其短篇小说体现出一整套完整的现实主义小说艺术，不过，尽管基本上恪守摹写真实的原则，崇尚逼真自然的写实方法，莫泊桑也并不放弃对非现实主义的艺术效果的追求，因为“对超自然现象和神秘主义的痴迷，一直纠缠着他，至死方休”（Dumesnil : 181）。的确，聚焦超自然现象的玄怪小说始终让莫泊桑情有独钟，在他一生创作的大约三百多篇中短篇小说中，“标准的”玄怪小说约占十分之一，有三十来篇。\n　　十九世纪初，正值浪漫主义的全盛时期，法国诞生了一种全新的文类——玄怪文学（la littérature fantastique）。尽管理论家们对玄怪文学的定义颇多争议，概括起来，一则“标准的”玄怪故事应该基本具备以下几个特点：首先，它必然是以现实为基础，“玄怪文学的特点，就是神秘（现象）入侵到真实生活的框架之中”（Castex : 8）， 早在1883年，莫泊桑也曾说过：“霍夫曼与爱伦•坡的超乎寻常的能力……就来自这种借助真实的事件使人困惑、产生玄怪感的特殊方式”（Maupassant, 1883 : 35）；其次，玄怪故事要让主人公或者读者在理性与非理性的解释之间难以定夺：“所谓的玄怪感，就是一个只了解自然法则的人，在遇到表面上超自然的事件时，他所感到的犹豫不决。”(Todorov : 29)；最后，玄怪故事经常催生恐惧的效果，这是许多理论家，也是许多玄怪小说家的看法，例如H.P.•拉夫克拉福特就认为：“只要让读者深切地感受到害怕与恐惧，感受到异常的世界与力量的存在，一篇故事就是玄怪的。”(Lovecraft : 16) 玄怪故事里无法用常识和理性解释的超自然现象往往折射出人的灵魂深处最隐秘的东西，某种程度上，主人公害怕的鬼魂不是外在于他的肉身，而是掩蔽在他的内心。\n　　十九世纪下半叶，玄怪故事的读者已经苛刻了许多，幽灵出没的古堡、形状怪异的妖魔、受到诅咒的修道士、与魔鬼订约……等题材已经很难引起人们的兴趣；相反，磁力说、催眠术、人类的精神疾病、外星球上生命迹象的发现……为玄怪故事的创作注入了新鲜的血液(Steinmetz : 79-90)。莫泊桑正是在这个时候开始写作他的玄怪故事的。\n　　在莫泊桑的玄怪小说中，《奥尔拉》占据着举足轻重的地位。小说最早发表于1886年10月26日的《吉尔•布拉斯》报上，1887年莫泊桑加以改写，由原来的六千多字扩展到两万二千字，重新发表在同名的短篇小说集中。\n　　一部文学作品的标题往往是“开启”全文的“钥匙”。某种程度上，标题暗示出作品的基调。但是，只有在阅读并理解了整部作品以后，读者才能完全领会标题的意义。法语中本来没有“奥尔拉”这个词语，所以，用它作为标题，首先代表着“不可理解”。 看过小说，我们知道，叙述者用“奥尔拉”（horla）一词来指称那个不断骚扰并逐渐控制自己的隐身生物，但关于这个标题，还是引来许多解释。例如，有人认为该词源于俄语oriol，意思是雄鹰（orla是oriol的所有格）；另一种说法是来自诺曼底方言中horzain一词，horzain是“陌生人、外来人”的意思；还有人认为，horla是choléra（霍乱）一词变换字母的顺序后得来的，因为1884年发生在法国南部的一场霍乱给莫泊桑留下了深刻的印象……不过，因为奥尔拉是主人公用肉眼无法看见的异类，我们觉得，最让人信服的说法还是认为horla源出于词组hors là，意思是“在外面”、“超出现实之外”、“彼岸世界”等等。\n"
"这3大生肖的女人，是家里的镇宅之宝，与她越恩爱越有钱","文化","在以前的社会，女人基本没有什么地位。她们在家庭里永远处在最底层，没有任何权利。但是现在社会不一样了，女人的地位不断的提高。这是因为人们意识到了一个女人在家中的作用。女人是家里的镇宅之宝，娶到这三种生肖的女人，越和她恩爱就越富贵！\n一.生肖是猪的女人\n属猪的女人生来温柔贤惠，特别善良。她们从小就心地好，所以面由心生，属猪的女人长得特别的好看。属猪的女人乐观，在嫁给男人之后，即使这个男人并不富裕，但是她们也从来不抱怨什么，愿意任劳任怨的一起和男人吃苦奋斗。男人只要对属猪的女人越好，就会越来越有钱。遇到这样的女人就快娶回家吧！\n二.生肖是兔的女人\n属兔的女人外表甜美可爱，温婉动人，是人群里一眼就能看到的那一个。但是，俗话说“狡兔三窟”，属兔的女人其实内心并不是和外表一样那么的柔弱，属兔的女人内心还是很精明霸气的，她们十分的精明能干，特别是在出嫁之后，不仅能把家里料理的好，还能旺夫。所以只要男人对她们越好，她们就越旺夫。\n三.生肖是蛇的女人\n属蛇的女人最有灵性，这样的女人只能被男人宠着，不能受委屈。因为属蛇的女人是掌管家里的财运的，只有让她们过得好，家里才会财运旺。所以娶到属蛇的女人是男人的福气，更重要的是在接下来的日子里，男人想有钱就得对她们越来越好。\n"
"“榕情四海”福州推介活动在比利时举行","文化","旨在展示福州传统文化魅力及城市发展新风采的2019“榕情四海”系列活动9月2日在比利时第二大城市安特卫普市举行。中国驻比利时大使馆大使曹忠明、安特卫普副市长范锦豪（Ludo Van Campenhout）以及比利时侨界侨领代表100余人参加了当晚的活动。\n曹忠明大使在致辞时说，“此次‘榕情四海’代表团专程来到比利时、来到安特卫普，实际上是在中华人民共和国成立70周年之际，一个非常好的推荐家乡文化、推荐中国文化的活动。希望代表团在安特卫普能够吸引更多的关注，把福州的经济商贸活动让更多的安特卫普人了解，同时也把福州的文化特色让更多的人了解。”\n范锦豪在讲话中表示，“众所周知，安特卫普在经济、文化还有其他领域与中国都有着十分密切的合作。我是一个分管体育事务的副市长，在刚刚的图片展，我发现了福州与安特卫普之间的很多共同点，比如福州曾举办过国际马拉松赛、自行车赛以及龙舟赛等，我觉得我们之间会有很多合作机会。”\n本次活动由福州市政府外事侨务办公室主办。福州市文化经贸代表团团长林峰在致辞中说，“榕情四海”活动是福州市顺应海外乡亲的需求，加强对外交流的品牌活动。我们旨在为海外乡亲展示福州独特的城市魅力及丰厚的传统文化，加强与海外乡亲的联谊，进一步扩大福州对外开放，发出“福州声音”，讲好福州故事，进一步吸引海外各界了解福州、关注福州、投资福州，增进福州与世界各国人民的友好交流，弘扬闽都文化。\n她表示，“今年，我们的‘榕情四海’活动来到了比利时这个开放和包容的国度，中比建交48年来两国人文交流密切，两国人民相近相亲，比利时的蓝精灵、丁丁历险记等故事在中国家喻户晓。今天在这里，我们通过图片展向世界展示新时代的福州风采，推介福州的投资环境，我们邀请非物质文化传承人现场制作具有浓郁福州特色的软木画、寿山石雕，我们用带着虾油味的风味小吃和清香飘逸的茉莉花茶向大家展示具有2200多年悠久历史的福州传统文化，来增进福州与比利时之间的友好往来，促进两地经贸交流与合作。”\n活动现场还举办了福州城市推介、经贸推介等活动，介绍了福州的悠久历史和社会经济发展情况，系统地推介了福州市投资环境，详细解读了优惠政策。例如，在经济贡献奖励方面，对新设立的外资企业，投资总额1亿美元以上或合作外资3000万美元以上的，从第一个纳税年度起，缴纳的增值税和企业所得税地方留成部分，第一、第二纳税年度给予100%奖励，第三至第五个纳税年度给予50%奖励。单个企业每年最高奖励1000万元。\n在高管生活补助方面，对外方股东实缴注册资本达500万美元的外资企业，按高级管理人员其所缴纳个人工薪所得税地方留成部分的50%，给予生活工作补助。\n此外，对设立外资地区总部和采购中心、结算中心、管理中心等功能性机构给予开办补助；对鼓励类外资工业项目优先供应土地，地价七折；鼓励企业在符合规划和安全要求、不改变用途的前提下，在工业园区原有建设用地进行厂房加层改造，增加用地容积率，不再增收土地价款，免收城市基础设施配套费用；符合产业用地政策的项目可实行先租后让、租让结合等方式使用土地等。\n"
"千年古村沸腾了! 跳起傩舞祈丰年","文化","每年春播后夏收前，在农历五月廿五这天，大源村民们都会跳起傩舞，以这种形式祈愿风调雨顺、五谷丰登。如今，已是福建省非物质文化遗产的大源傩舞成为当地旅游的新热点。（报道组 邱灿旺）\n"
"湖北省“国家品牌计划——广告精准扶贫”：恩施硒土豆","文化","传说，仙境出鲜品。神秘的北纬30度，世界级富硒生物圈，土苗小精灵——天然含硒的恩施土豆，在这里悄悄生长。\n"
"佣兵之王重归都市，身陷阴谋，虎视群雄，刀剑出鞘，撕开谜题！ - 杏花岭新闻网","文化","现在越来越多的朋友喜欢看网络小说，很多人在追这些书的时候，因为有的书还没有完结，但更新的速度又没有那么快，正过眼瘾的时候突然断更了，再看别的新书又没心思看进去，出现书荒也是非常难受的。下面小编就为大家带来几部精彩小说！佣兵之王重归都市，身陷阴谋，虎视群雄，刀剑出鞘，撕开谜题！\n《兵王传》——作者：繁星小e\n【简介】我不想那么的平凡，我的路是我决定的，我会守护我的朋友亲人爱人，如果谁敢触及，我的底线，天上地下必杀之一代杀神在这里崛起。\n【书摘】再说了，初始做佣兵时，他就是被当杀手培养，干的就是脏活累活，学的就是各种应对技巧，如果想杀一个人，前台，保安都进不去，还当什么杀手啊。这种小保安说白了就是个摆设，你越叼他，他越牛逼，就会拦你，反之，你不把他放在眼里，他还以为你是个什么了不起的人物，根本不敢死拦你。果不其然，保安见他昂首阔步，神态自信的样子，犹豫了一下放弃了，没敢上前阻拦。辰南来到电梯前，电梯门就要关闭，只剩下一个缝隙，被他伸手拉开，一头钻了进去。\n《至强兵王》——作者：平放\n【简介】唐风，昔日的佣兵传奇，走在繁华都市之间，踩阔少，抱美女，说不尽的惬意美好，一双铁拳，打趴下一个个敌人，保护自己的的女人，一切尽在都市至强兵王。\n【书摘】汪敏，你的能力，是不是跟雷电有关？看向汪敏，带着一丝的好奇问道。坐在那里的汪敏，脸上强挤出一抹的笑意来，微微点了点头，肯定了他的猜测。当初这种能力觉醒后，我心里害怕，就离开了德意志，返回了华夏，就算是回国后，我也没敢主动去使用过这种能力，可即便是如此，这种能力，还是带给了我许多的麻烦。汪敏缓缓说道。我能感觉到，我与雷电，有着非常强的契合度，有的时候，我的手指碰触在电线上的时候，都可能引爆其中的电，特别是打雷的时候，雷电总是会在我家房子上空盘踞。\n《超级兵王》——作者：何为道\n【简介】铁血兵王回归，身负新仇旧恨，掀起血雨腥风。为兄弟两肋插刀，为美人刀山火海。年轻就要热血，巅峰少年纵横都市，书写不败的传奇！\n【书摘】这人的装扮与报警人叙说的一般无二，宁若瑜扭头看了他一眼，十分确定他就是那个公交车上的变态，只是他怎么会突然拿刀出来，难道我的身份被识破了？别乱动，不然我手里的刀可没长眼睛，割花你哪儿就不漂亮了。眼镜男舔了舔嘴唇，将刀交到左手，右手伸进了宁若瑜肩上挎着的小包里，不一会儿从里面摸出一副亮晃晃的手铐，眼镜男脸上的得意之色更盛，他拿着手铐在宁若瑜眼前晃了晃，调笑道：想不到小美人身上还带着这个，是不是想和我玩点更刺激的游戏？\n《最强兵王》——作者：磨剑少爷\n【简介】曾经扬名世界的佣兵之王，卸甲归田重归都市，身陷阴谋，虎视群雄，刀剑出鞘，撕开谜题，让人为之折服！\n【书评】每一章都是下了功夫的，把文字当成了一件自己珍爱的物品，所以精心打磨，尽自己的能力构建起一个世界，而不是以码字为目的。这一点已经可以强过百分之90以上的网文作者了，写的内容很丰富，很有想象，代入感再强一点，人物形象很贴近喜感形象，往往都可引人入胜，浮想联翩。看的就是情节，看的就是代入感，看的就是能让你忍俊不禁，宛然一笑。\n好了，今天就分享到这里了，希望大家看的开心！喜欢小编推荐的书可以在右上角点击关注哦！如果还有好书的话，可以在评论区留言，大家相互交流，最后谢谢大家的观看，祝各位生活愉快！\n"
