title,category,content
"ACI職業能力認證服務人才 打造施展才華天地","文化","面對日益嚴峻的就業形勢，越來越多人通過考證來增加自身的砝碼。“考證熱”浪潮經久不衰，不少職場小白也都感到十分困惑：“除了證書，如何證明自己比別人強?”而人力資源從業人員認為：“考證值得提倡，至少證書證明了應聘者上進與好學，證書更多是一種自我價值的展現。”\n事實上，不少考證者都比較理性，並非為了考證而考證，而是有更多自己的考慮。李女士告訴記者：“網際網路時代下有很多發展的機遇，擁有一門技能就可以自帶光環。我的閨蜜是個家庭主婦，可她對養生飲食很有研究，考取了ACI國際註冊營養師證書，就能在自媒體平臺上開課，有了粉絲和打賞。我也希望能夠提升自己，走出新的職業道路。”\n另一位學員劉女士有意考取ACI註冊國際理財師證書，她認為理財是一門基礎的技能，無論有沒有從事金融行業，都會使自己終身受益。她説：“結婚後我就掌握家裏的財政大權，手裏頭有點閒錢想要投資，但又害怕有風險。報名考證讓我接觸到了家庭理財的相關知識，系統而規範地認識到什麼樣的理財産品適合自己，怎樣的投資比例能夠控制風險，真的是每個人都應該去學的財富管理課。”\n張先生在今年成功考取了ACI心理諮詢師證書，他告訴記者，“ACI在中國每年的3月、6月、9月和12月舉行考試，在考試結束一個月後，可以在ACI中國總部網站查詢成績及證書情況。儘管在一邊工作，一邊用三個月或半年時間準備一場考試有點困難，但有了這一職業能力認證的渠道，也給了我一個很好的途徑去證明自己。”\n事實上，在國內報考全球通用證書的情況已經十分普及，幾乎每個城市都會有相關的培訓機構，有對應的考點。目前，美國認證協會(ACI)面向全球推出了20余項專業認證考試，其認證代表了當今職業認證的國際水準，而ACI中國在各地事務由北京東方匯才國際文化交流有限公司全權代理。\n據了解，ACI全稱為美國認證協會(American Certification Institute)，總部坐落于美國加州洛杉磯，是由美國哈佛大學、德州大學、耶魯大學、加州大學、杜克大學、森坦那瑞商學院等美國數十個著名院校的專家教授共同組成的在全球範圍內從事國際職業認證的專業機構，長期致力於專家級高水準認證、考試服務。\n近年來，隨著國外證書愈發受青睞，東方匯才大力引進國際先進的教育項目，成為國際權威認證機構美國認證協會ACI在中國的管理和執行機構，匯聚優質資源，大大地促進中外商務交往和中外文化交流，得到了行業內的廣泛認可。\n在職業能力認證上，ACI一直緊跟潮流，結合實際國情，推出接地氣的項目。相對於其他證書機構，ACI的培訓特色在於：高品質的教學品質、全方位的素質合成、中外專家精英、國際通行職業金卡。ACI十分重視人才培養，在基礎培訓課程之外還擁有完善的全程跟蹤測控、教師評估、證書查詢體系來保證培訓及認證的權威性，這都是其他機構望塵莫及的。\nACI在培訓方面給予很大的重視和投入，應用國外先進理念，尊重人才成長的客觀規律，讓不同層面的學員都能找到適合自己的學習方式。另外，ACI組建眾多講座與交流會活動，不斷加強學員間的合作與學習，並選拔優秀學員前往國外學習等，讓每一位學員都有發展的空間，引導人們充分認識自我、開發自我、經營自我、挑戰自我。\nACI負責人告訴記者：“人才培養從根本上就是開發人才潛能的工作，我們並不希望學員為了考證而考證，而是更注重培養學員學習的主觀能動性。希望ACI是激發他們潛能的平臺，能為學員提供更多的職業可能性，更豐富的職業生涯，是學員施展才華，實現人生價值的舞臺。”\n總而言之，證書是自身知識體系的延伸，是個人興趣的反映。考證必須要越精越好，無論學生還是職場人士，一定要抱著學以致用的原則進行選擇，用證書為職業生涯添磚加瓦，用證書來展現自己的能力與實力，充分發揮出其作用，發揮證書最大的價值。\n"
"青海藏区考古基地开工建设","文化","　　中新网西宁9月4日电（记者罗云鹏）青海省文化和旅游厅4日介绍，该省藏区考古基地开工建设，项目建成后将成为该省首个用于田野发掘文物保管、整理、修复于一体的综合性文物库存馆。\n　　青海藏区是中国除西藏自治区之外最大的藏族聚居区，中国10个藏族自治州中6个分布在青海境内，其中丝绸之路南亚廊道（青海段）、丝绸之路青海道以及唐蕃古道沿线是该省藏区文物富集区。\n　　青海藏区考古基地位于该省海南藏族自治州贵德县古城内，占地10亩，建筑面积6000平方米，总投资3000万元人民币。\n　　青海省文化和旅游厅介绍，青海藏区考古基地项目建设内容包括文物精品展厅、田野发掘文物修复室、文物修复互动体验室、考古学术报告厅、文物整理库房等。\n　　据了解，青海藏区考古基地主要开展文物修复和复制研究，文物精品展览展示，设计考古体验活动项目，组织考古专业培训，开展传统文化教育和开发高端文化旅游产品等工作。\n　　青海省文化和旅游厅表示，该项目建成后将通过一流文物修复与保护技术、先进设施设备以及较高文物陈列水平，展现青海文物考古研究工作主要成就和考古发掘技术水平以及考古学学科发展体系，在推进青海文化遗产有效保护和利用发挥中重要作用。\n"
"飯店毒趴害死小模 土豪哥判2年10月定讞","文化","「土豪哥」朱家龍被控3年前，在W飯店辦毒趴害死郭姓女模，一審將他判刑10年，高院更一審認為郭女案發前4個月內不斷施用二級毒品PMA才是猝死關鍵，改將他輕判2年10月，最高法院駁回上訴確定，朱男已被羈押785天，今年初才獲交保。\n「土豪哥」朱家龍。（中央社）\n最高法院表示，朱家龍與死者家屬達成和解，量刑部分原判決並無不當，檢方請求重判、被告主張量刑太重，都沒有理由，駁回上訴、將朱男判刑2年10月定讞；由於刑事訴訟法已修法，檢方可以在判決確定後，展開拘提或防逃措施。\n檢方起訴，朱在2016年12月2日入住W飯店後，隨即前往酒店與友人 洪聖晏、蔡逸學聚會飲酒，隔天凌晨3人回到W飯店續攤開毒趴，朱提 供毒軟糖、毒梅片等各式毒品，郭女4日進入飯店房間，眾人連開3天 毒趴，期間郭女持續混用至少9種毒品致死。\n一審及高院二審都認定，朱辦毒趴導致郭女吸毒死亡，案經最高法院撤銷發回，高院更一審依法醫所鑑定結果認為，郭女發前4個月內不斷施用PMA，體內PMA濃度超標18倍，極有可能是造成郭女發生中毒 性休克的主因。\n朱家龍與其他在場人士，體內都未驗出PMA成分，無法認定朱等人 有轉讓PMA毒物給被害人使用，郭女長期施用過量PMA是個人行為，朱等人轉讓禁藥和其死亡沒有因果關係，且朱等人也無法預見郭女會死 亡，變更起訴法條，以較輕刑度的轉讓禁藥罪判刑。\n更一審考量朱家龍等人犯後彼此卸責，避重就輕，難認有悔意，再 加上轉讓禁藥長達5天情形嚴重，將朱判刑2年10月，同案被告洪聖晏 、蔡逸學各改判2年6月。也因變更起訴法條裁判，讓朱家龍以100萬 元、洪聖晏15萬交保。\n★中時電子報關心您：保護自己、遠離毒品!\n(中時 )\n#飯店#一審#判刑#毒品#土豪哥\n"
"宋慶齡文物文獻展開幕，400餘件展品中百余件首次在滬展出","文化","原標題：宋慶齡文物文獻展開幕，400餘件展品中百余件首次在滬展出\n「為新中國奮鬥——宋慶齡文物文獻特展」 。本文圖均為 澎湃新聞記者 李菁 圖\n9月4日，「為新中國奮鬥——宋慶齡文物文獻特展」在上海城市規劃展示館開幕，展覽將持續至10月15日。\n宋慶齡生前影像\n澎湃新聞（www.thepaper.cn）記者從展覽現場獲悉，此次展覽彙集了京滬兩地六家相關宋慶齡紀念單位的珍貴文獻、文物、照片等400餘件，其中100餘件系首次在滬展出。\n該展覽由上海宋慶齡研究會、上海市孫中山宋慶齡文物管理委員會、中國福利會、中國宋慶齡基金會研究中心聯合主辦。\n宋慶齡的信函與筆記\n主辦方介紹，此次展覽圍繞宋慶齡「為新中國奮鬥」這一主題，內容包括「奮鬥：為締造新中國」「 奮鬥：為建設新中國」「 奮鬥：架設通向世界的友誼橋樑」三個部分，以宋慶齡的言論為線索，表現宋慶齡為新中國奮鬥的初衷和理想。\n用文物講述「為新中國奮鬥」故事，是本次展覽最突出的特點。\n宋慶齡所著《為新中國奮鬥》、宋慶齡保存的國民傷兵醫院服務章、宋慶齡在抗戰募捐收據上使用的金戒指印章、抗戰期間宋慶齡贈給美國友人的旗袍、國際友人贈送的紀念物、宋慶齡創辦的《中國建設》創刊號等一件件珍貴的文物，無聲地講述著宋慶齡為締造新中國、建設新中國不懈奮鬥的歷史故事。此外，展覽還專門辟出了一個版面展示宋慶齡各個時期的個人照片影像。\n同時，展覽充分借鑒學術界最新研究成果和觀點，是宋慶齡最新研究成果的一次集中展示。\n1946年12月17日，周恩來致函宋慶齡，信中表示感謝：「延安的朋友們都惦念著您，感謝您為解放區人民所做的工作。」\n1961年2月8日，宋慶齡為辭謝國家為她另建新住所一事復王光美的簽名信。\n從青年時代起，宋慶齡就不畏艱險，追隨孫中山先生，致力於民主革命事業。孫中山先生逝世后，她堅決維護孫中山的三大政策。在艱難困苦的長期革命鬥爭中，她都堅定地和中國共產黨站在一起，同中國共產黨密切合作，為中華人民共和國的誕生，建立了不朽的功績。新中國成立后，她長期擔任國家領導職務，為社會主義革命、建設和改革事業、婦女兒童福利事業，為人類進步與世界和平，作出了獨特的貢獻。\n宋慶齡與孫中山的影像資料\n宋慶齡為孩子們親筆繪製的賀年卡\n配合本次展覽，主辦方聯合人民出版社重新出版了宋慶齡所著文集《為新中國奮鬥》，將向宋慶齡研究機構、圖書館、紀念館、學校等和宋慶齡事業相關的單位贈送。此外，本次展覽還展示了孫中山宋慶齡系列主題圖書和文創產品。\n"
"長三角建立預防青少年違法犯罪聯動機制","文化","新華社上海9月4日電（記者 李榮）上海市金山團區委與浙江平湖團市委、嘉善團縣委等近日在滬簽署協議，共同建立長三角毗鄰地區預防青少年違法犯罪聯動機制，併發布青少年普法合作項目。\n據了解，為共同維護好滬浙接壤區域的平安穩定，此次長三角毗鄰地區將共同搭建預防青少年違法犯罪信息共享平臺，不斷推進基層社會治理創新，加強邊界區域法治化、規範化、科學化管理，促進邊界區域社會組織聯動發展。\n長三角相關地區將加強信息溝通，精準掌握重點青少年動態，努力消除各種不穩定隱患，快速果斷處置各類應激事件；共同防範青少年違法犯罪，有效增強青少年法治意識；提升共青團組織在邊界區域青少年中的影響力，共同維護邊界區域平安穩定。\n“鑫·説法”小公民法律課堂系列活動，是上海市金山區全面推進依法治區的重要舉措，分為情景課堂、社區課堂、校園課堂三部分內容，整合普法基地、學校、社區等多方資源，根據不同青少年的群體特點，多層次、多載體、多樣化推進青少年法治宣傳教育。下一步，上海金山將依託華東政法大學的法律教育資源，聯合平湖、嘉善等長三角毗鄰地區的普法宣傳陣地，幫助青少年樹立正確的法治觀念，促進養成良好的行為習慣。\n"
"媽祖文化節邀24首長獻舞挨轟 宜縣府：未強迫","文化","宜蘭縣將舉辦媽祖文化節，縣長林姿妙在昨（3）日帶領24位縣府一級主管，大跳香港90年代天團草猛的失戀陣線聯盟舞曲，但縣議員痛批，林姿妙把首長都當成餘興節目，縣府回應，局處首長都是利用下班時間來練舞，沒有強迫。\n▼縣長林姿妙帶領24位縣府一級主管跳失戀陣線聯盟舞曲。（圖／東森新聞）\n宜蘭縣長林姿妙和局處首長手牽手一起為媽祖文化節獻舞，踩著輕快的舞步，左腳右腳，左腳右腳，還跳起探戈 。\n歌曲失戀陣線聯盟：「你說你學不會假裝瀟灑，卻叫我別太早放棄她，把過去全說成一段神話，然後笑彼此一樣地傻。」\n局處首長們似乎都舞蹈細胞都很好，只有林姿妙跳起舞來稍微卡卡，每次換動作時都會慢半拍，還要觀望一下旁人。\n▼林姿妙每次換動作時都會慢半拍。（圖／東森新聞）\n歌曲失戀陣線聯盟：「找一個承認失戀的方法，讓心情好好地放個假。」\n到最後不知道是不是妙妙姐的個人秀，只見她左右不分，舉手繞圈時跟所有局處首長舉起來的手全都相反，只是縣府局處首長跳草蜢舞曲和媽祖文化到底有什麼關聯引來撻伐。\n縣議員謝燦輝：「不是叫這些局處長來做這些跳舞的動作，應該去加強媽祖的文化在哪裡。」\n▼縣議員謝燦輝表示，不應跳這些舞而是要加強媽祖的文化在哪裡。（圖／東森新聞）\n縣府說為了媽祖文化節總共練舞約五天，每次一到一個半小時，看當天出席狀況，這幾天局處首長約有六成出席率。\n宜蘭縣府人事處長黃水桐：「沒有強迫局處首長，就是自己看他的業務狀況允許的話。」\n縣府強調沒有強迫局處首長跳舞也沒有佔用主管們上班辦縣務的時間，希望外界不要無限上綱。\n（封面圖／東森新聞）\n"
"毕节市第七届钱币交流拍卖会举行","文化","为促进钱币收藏爱好者之间的交流，丰富广大藏友的藏品，近日，由毕节市钱币协会主办的毕节市第七届钱币交流拍卖会在七星关区举行。\n此次拍卖活动共有83件藏品参与竞拍，其中，最吸引收藏爱好者的是“贵州汽车银币”。据毕节市钱币协会名誉会长李国俊介绍，“贵州汽车银币”是1928年贵州造币厂为纪念贵阳——桐梓公路通车而制造的，其生产量不大，只在省内流通，因此十分稀少，价值也更珍贵。\n"
"中国美术学院举行2019级开学典礼 望新生传承美院精神","文化","图为典礼现场。 美院提供\n　　中新网浙江新闻9月4日电（谢盼盼）9月3日，在中国美术学院（简称“中国美院”）象山校区8号楼体育馆内，2506名2019级全体本科生、研究生、港澳台学生和留学生们将在庄严的仪式中，开启艺术之路，写下自己的精彩的未来。\n　　上午九时，典礼将在庄严的国歌声中开幕。该学院党委书记钱晓芳、院长许江将首先向新生代表赠送了笔、墨、纸、帖和一本《国美美文》作为开学大礼，这份凝聚着传统文化精髓与前辈殷殷期许的礼物，将激励来自五湖四海的学子们，在“行健、居敬、会通、履远”校训的见证下，从这里出发，书写青春，勃发向上。\n图为许江致辞。 美院提供\n　　从2014年开始，中国美院开始为入校新生们发放这样一份特殊的礼物。许江也在数次的开学典礼讲话中，解释了这份礼物的用心良苦：完美把握毛笔，是成为艺术匠人的第一步。学子们需要通过一支毛笔、一本千年读本的临写，体验千百年来文化传承的汉字书写之感，一笔一划构建起来文字意韵、眼读手写时带给生命世界的万象纷呈。“如何从根本上体会这种“上手”背后所蕴含的诸种心手变化、价值感受，从而与中国文化世界的浅显感受、深邃意念牢牢地联系在一起，中国书法的学习是最好的启蒙。”\n　　中国美院自建校以来被先贤前辈的诗性与精神所熏陶着学院的成长，学院的精神是一支接力棒，不仅要将一代代建设者的责任和意识传承下去，也要将美院的人文理想和目标传递下去，链接着学院师生心胸相照、气息相关的学术追求，凝聚成一所院校的人文关怀和主体精神。\n　　而今年同时送给新生们的还有一本《国美美文》第一辑《湖山望境》，《国美美文》文丛，是将历史迄今的中国美术学院师生美文，据不同意向，辑成专册，以昭示美院传承无断的文心，让代代后学，因着蕴藉谱系音息的诗文和阅读，濡染如上所述的关于世界的缩影和雏形，塑成某种学术家族的格趣与品性。\n图为典礼现场。 美院提供\n　　正如许江院长在开学典礼的讲话中讲到：“在这《国美美文》的书里，我们首先读到的是一种艺者特有的激情与凝重，一种絪缊于所有艺术之上的诗性。如此诗性之中凝着国美各个年代的文化担当，凝着世代先师的噎心瞩望，凝着先师们充满个性的云山归踪。如此诗性既见师者一己的志向之殷，更见一校图报国家的使命之切。所以，本书的阅读是伴着一条与我们今天戚戚相关的悠长文脉的，是伴着一种家书式的诚意与兴答。蔡公的远瞩，林公的殷切，滕公的凝重，寿师的高格，羽师的情操，自是美院文心之无尽藏。李金发先生的象征开篇，艾青先生的嘹亮芦笛，吴冠中先生的率性横站，陆维钊先生的深潜淘养，范景中先生的铸史文心，俱是一代文坛的清言亮色。名师放怀，和气所钟，青春命笔，激情聚风。此湖山之象委身于美文，凝成国美风华，树立名校风范。这文心，这美文，这浩然诗性，代表着国美世代接续的人文高度，是美院真正的山壑。”\n　　随后，副院长王赞宣布中国美术学院关于表彰2019级新生奖学金获得者的决定，学院领导为获奖学生代表颁奖。学生代表上台朗诵中国美术学院校训释文，激昂振奋之情感动现场所有师生。（完）\n"
"高林生-扣肉网","文化","”　　每一位参与这项公益活动的人都发自内心地支持LifeWater的“半瓶水”。...\n"
"花旗銀行：第二季信用卡業務放緩","文化","香港社會動盪持續或拖累經濟表現，香港花旗銀行總經理林智剛稱，對整體銀行業的影響不大，但留意本地零售及飲食業有放緩，或會波及銀行信用卡業務與部分貸款增長，但銀行整體收入增長仍理想。\n他解釋，該行信用卡業務第二季起已有放緩情況，由於8月為旅遊旺季，留港消費的港人亦相應減少，如9月放緩情況持續，則值得業界關注。至於新增客戶及存款增長暫未見有顯著改變。\n香港經濟下行風險浮現，中小企隨時首當其衝。他表示，花旗將香港全年經濟增長預測(GDP)由1.5%下調至0.9%，主要受中美貿易戰時好時壞、零售及就業放緩因素拖累，該行正積極與旗下中小企尋求解決方案，吸引更多旗下零售客戶到上述中小企消費，包括餐飲及零售業。\n他又指出，港元拆息(Hibor)仍然波幅不斷，儘管美國有減息預期，但受季結、潛在招股活動及香港銀行結餘規模變少，拆息仍有上升空間，可能會推動銀行業推出高息定期存款。\n首批虛擬銀行最快於今年底或明年初開業，他形容對業界「有危有機」，因可促使業界進行電子化，吸納更多從來未接觸過的新客戶。\n他透露，該行有90%以上的交易已不是經人手操作，手機銀行用戶更按年大增60%，70%的電子外匯交易已經手機完成，股票買賣則佔逾半。該行目前已推出遙距開戶，期望年內可將服務伸延至股票戶口。\n－－－－－－\nClick下面粒掣，儲on.cc coins！機票、家電、超市禮券、過萬份獎品等緊你。\n"
"“宋庆龄文物文献特展”在沪开幕","文化","为庆祝中华人民共和国成立70周年，由上海宋庆龄研究会、上海市孙中山宋庆龄文物管理委员会、中国福利会、中国宋庆龄基金会研究中心联合主办的“为新中国奋斗——宋庆龄文物文献特展”，今天在上海城市规划展示馆开幕。\n展览是以“宋庆龄与新中国”为主题的大型文物文献展览，紧紧围绕宋庆龄“为新中国奋斗”这一主题，内容包括“奋斗：为缔造新中国”“ 奋斗：为建设新中国”“ 奋斗：架设通向世界的友谊桥梁”三个部分，以宋庆龄的言论为线索，表现宋庆龄为新中国奋斗的初衷和理想，全面、详实展示宋庆龄和中国共产党风雨同舟，为中国革命、建设和改革事业、为世界和平和人类进步事业，所做的独特贡献和宝贵精神财富。此次展览汇集了京沪两地六家相关宋庆龄纪念单位的珍贵文献、文物、照片等400余件，其中100余件系首次在沪展出。展览充分借鉴学术界最新研究成果和观点，是宋庆龄最新研究成果的一次集中展示。\n用文物讲述“为新中国奋斗”故事是本次展览最突出的特点。宋庆龄所著《为新中国奋斗》、宋庆龄保存的国民伤兵医院服务章、宋庆龄在抗战募捐收据上使用的金戒指印章、抗战期间宋庆龄赠给美国友人的旗袍、国际友人赠送的纪念物、宋庆龄创办的《中国建设》创刊号等一件件珍贵的文物，无声地讲述着宋庆龄为缔造新中国、建设新中国不懈奋斗的历史故事，讲述着那具有中国特色的革命和建设道路。展览还专门辟出了一个版面展示宋庆龄各个时期的个人照片影像。展览将持续到10月15日。\n中华人民共和国名誉主席、新中国的缔造者之一宋庆龄同志，是举世闻名的爱国主义、民主主义、国际主义、共产主义的伟大战士。宋庆龄的一生，是为新中国奋斗的一生。从青年时代起，她就不畏艰险，追随孙中山先生，致力于民主革命事业。孙中山先生逝世后，她坚决维护孙中山的三大政策。在艰难困苦的长期革命斗争中，她都坚定地和中国共产党站在一起，同中国共产党密切合作，为中华人民共和国的诞生，建立了不朽的功绩。新中国成立后，她长期担任国家领导职务，为社会主义革命、建设和改革事业、妇女儿童福利事业，为人类进步与世界和平，作出了独特的贡献。宋庆龄所建树的丰功伟绩，受到全党、全国各族人民的衷心爱戴，受到世界各国爱好和平和正义事业的人民的仰慕和崇敬。\n举办本次展览，就是纪念缅怀宋庆龄同志，学习她为国家独立富强、人类发展进步不懈奋斗的爱国热忱和崇高风范，用宋庆龄的文物文献，来讲述宋庆龄为新中国的诞生和建设拼搏奋斗的故事；以宋庆龄为新中国奋斗的独特视角，讲述新中国的奋斗历史，激励我们继承和弘扬宋庆龄同志“为新中国奋斗”的坚定信念和奋斗精神，紧密团结在以习近平同志为核心的党中央周围，不忘初心，牢记使命，为实现“两个一百年”奋斗目标、实现中华民族伟大复兴的中国梦而不懈奋斗。\n（看看新闻Knews记者：沈倩 实习编辑：浦帆）\n版权声明：本文系看看新闻Knews独家稿件，未经授权，不得转载。\n"
"聯合國：英國無協議脫歐累出口　最少恐損失160億美元","文化","英國於10月31日硬脫歐風險增加，聯合國貿易和發展會議(UNCTAD)表示，若然英國無協議下脫歐，其對歐盟的貿易將損失至少160億美元，相當相關出口總額的約7%。如果將間接影響考慮在內，損失可能會更大。\n"
