title,category,content
"上饶市第四届人民代表大会常务委员会公告（第29号）","文化","《上饶市历史建筑保护条例》已由上饶市第四届人民代表大会常务委员会第十八次会议于2018年12月28日通过，江西省第十三届人民代表大会常务委员会第十二次会议于2019年3月28日批准，现予公布，自2019年5月1日起施行。\n上饶市人民代表大会常务委员会\n2019年4月26日\n上饶市历史建筑保护条例\n(2018年12月28日上饶市第四届人民代表大会常务委员会第十八次会议通过 2019年3月28日江西省第十三届人民代表大会常务委员会第十二次会议批准)\n目 录\n第一章 总 则\n第二章 保护名录\n第三章 保护措施\n第四章 法律责任\n第五章 附 则\n第一章 总则\n第一条 为了加强历史建筑保护，传承优秀历史文化遗产，根据《历史文化名城名镇名村保护条例》《江西省传统村落保护条例》和其他有关法律、法规的规定，结合本市实际，制定本条例。\n第二条 本条例适用于本市行政区域内历史建筑的保护及其相关管理活动。\n本条例所称历史建筑，是指经县级人民政府确定并公布的具有一定保护价值，能够反映本地历史风貌和地方特色，未公布为文物保护单位，也未登记为不可移动文物的建筑物、构筑物。\n第三条 历史建筑的保护应当遵循严格保护、科学管理、合理利用、社会参与的原则。\n第四条 县级以上人民政府负责本行政区域内的历史建筑保护工作，将其纳入国民经济和社会发展规划以及城乡规划，所需资金列入本级财政预算。\n县级以上人民政府住房和城乡建设主管部门具体负责本行政区域内历史建筑的保护和监督管理工作。\n县级以上人民政府文物、发展改革、自然资源、财政、公安、应急管理、市场监督管理、旅游、民政等主管部门按照各自职责做好历史建筑保护的相关工作。\n乡(镇)人民政府、街道办事处负责本行政区域(辖区)内历史建筑保护的日常巡查和监督，配合上级人民政府和有关部门做好历史建筑的保护工作。\n村(居)民委员会协助政府和有关部门做好历史建筑的保护工作，将历史建筑保护内容纳入村规民约。\n第五条 县级以上人民政府应当建立历史建筑保护协调机制，负责统筹、协调历史建筑保护工作。\n第六条 鼓励单位和个人以捐赠、出资以及提供实物、技术和服务等方式参与历史建筑的保护。\n第七条 县级以上人民政府应当通过报刊、广播、电视、网络等媒体加强历史建筑保护的宣传教育工作，增强公众的历史建筑保护意识。\n第八条 任何单位和个人都有依法保护历史建筑的义务，有权劝阻、检举破坏历史建筑的行为。\n第九条 县级以上人民政府及其有关部门对在历史建筑保护中作出突出贡献的单位和个人，按照有关规定予以表彰、奖励。\n第二章 保护名录\n第十条 历史建筑保护实行名录管理。\n第十一条 未公布为文物保护单位，也未登记为不可移动文物的建筑物、构筑物，具备下列条件之一的，可以认定为历史建筑：\n(一)建筑样式、结构、材料、施工工艺或者工程技术具有建筑艺术特色或者科学研究价值的;\n(二)反映本地区历史文化和民俗传统，具有时代特征和地域特色的;\n(三)在经济社会发展史上具有代表性或者典型性的;\n(四)与重大历史事件、著名人物或者重要组织机构有关，具有纪念意义的;\n(五)其他具有历史、文化、科学、艺术价值或者纪念意义的。\n历史建筑的种类包括民居、祠堂、书院、会馆、商铺、寺观、楼阁、厂矿、作坊、牌坊、戏台、桥梁、驿道、巷道、码头、围墙、石阶、铺地、驳岸、沟渠、墓、塔、亭、坝、井等。\n第十二条 县级以上人民政府住房和城乡建设主管部门应当定期开展历史建筑普查工作。\n第十三条 符合历史建筑条件的建筑物、构筑物，其所有权人可以向县级人民政府住房和城乡建设主管部门申报。\n符合历史建筑条件的建筑物、构筑物，其所有权人没有申报的，县级人民政府住房和城乡建设主管部门可以提出申报建议。仍不申报的，由所在地乡(镇)人民政府、街道办事处负责申报。\n符合历史建筑条件的建筑物、构筑物，其所有权人不明确的，由使用人或者乡(镇)人民政府、街道办事处负责申报。\n第十四条 县级人民政府住房和城乡建设主管部门应当组织专家对申报的建筑物、构筑物进行评估认定，经县级人民政府确定后予以公布，并报市人民政府备案。\n历史建筑的申报、评估、确定和公布程序由市人民政府住房和城乡建设主管部门制定。\n第十五条 历史建筑被公布为文物保护单位、被登记为不可移动文物的，由县级人民政府移出保护名录;历史建筑损毁、灭失的，经县级人民政府住房和城乡建设主管部门组织专家评估认定失去保护价值的，由县级人民政府决定移出保护名录。移出保护名录的，应当报市人民政府备案。\n第三章 保护措施\n第十六条 县级人民政府住房和城乡建设主管部门应当编制包含历史建筑基本信息、保护范围和使用要求的历史建筑保护图则，经本级人民政府批准并予以公布。对历史建筑进行保护，应当符合保护图则的要求。\n第十七条 县级人民政府住房和城乡建设主管部门应当建立历史建筑档案。\n第十八条 县级人民政府住房和城乡建设主管部门应当对历史建筑设立保护标志。\n第十九条 历史建筑实行保护管理责任人制度。\n国有历史建筑，其管理人是保护管理责任人;管理人不明确的，由历史建筑所在地县级人民政府确定。非国有历史建筑，其所有权人是保护管理责任人;所有权人不明确的，其使用人是保护管理责任人;所有权人不明确，且没有使用人的，由历史建筑所在地乡(镇)人民政府、街道办事处确定保护管理责任人。\n第二十条 县级人民政府住房和城乡建设主管部门应当与历史建筑保护管理责任人签订保护责任书。责任书中应当载明历史建筑保护管理责任人应当履行的下列义务：\n(一)保持历史建筑原有的体量、立面和色彩;\n(二)保护历史建筑的传统空间格局、外貌特征和特色装饰的完整性;\n(三)保障历史建筑的结构安全;\n(四)保障历史建筑的消防安全;\n(五)实施历史建筑的日常维护;\n(六)其他依法应当履行的保护义务。\n第二十一条 历史建筑因损坏需要维修的，保护管理责任人应当制定维修方案并向县级人民政府住房和城乡建设主管部门报告。县级人民政府住房和城乡建设主管部门应当加强对历史建筑维修的监督、指导和服务。\n历史建筑维修应当遵循修旧如初的原则，采用传统工艺技术，保持历史建筑的原有形制、结构和工艺。\n第二十二条 历史建筑有损毁危险的，保护管理责任人应当及时采取必要的抢救性措施，并向乡(镇)人民政府、街道办事处或者县级人民政府住房和城乡建设主管部门报告。保护管理责任人不具备维修能力的，县级人民政府住房和城乡建设主管部门应当给予帮助。\n第二十三条 保护管理责任人承担维修费用确有困难的，可以提出申请，经县级人民政府住房和城乡建设主管部门审核并报本级人民政府批准后，从历史建筑保护经费中给予补助。\n经政府补助维修的历史建筑出售的，县级人民政府应当从出售历史建筑的收益中收回补助资金，用于其他历史建筑的保护。\n第二十四条 历史建筑保护经费的来源包括：\n(一)上级财政拨付的资金;\n(二)本级财政预算安排的资金;\n(三)社会各界捐赠的资金;\n(四)其他依法筹集的资金。\n第二十五条 历史建筑实行原址保护。建设工程选址，应当尽可能避开历史建筑;因特殊情况不能避开的，应当制定相应保护措施。\n历史文化名城名镇名村范围外的历史建筑，因地质灾害等不可抗拒的自然因素无法实施原址保护，需要迁移异地保护的，应当经县级人民政府批准。\n历史文化名城名镇名村范围外的历史建筑，因公共利益需要进行建设活动，无法实施原址保护，需要迁移异地保护的，应当由县级人民政府住房和城乡建设主管部门提出申请，经本级人民政府审核后，报市人民政府批准。\n历史文化名城名镇名村范围外的历史建筑，因客观条件限制不能实施有效保护，为更有利于保护需要迁移的，应当由保护管理责任人提出申请，由县级人民政府审核后，报市人民政府批准。\n经批准对历史建筑实施迁移保护的，实施单位应当编制迁移方案，做好测绘、文字、影像等资料建档工作，妥善保管历史建筑构件。\n第二十六条 历史建筑已经毁坏的，由县级人民政府住房和城乡建设主管部门决定是否实施遗址保护。\n已经毁坏的历史建筑需要在原址重建的，由县级人民政府住房和城乡建设主管部门报市人民政府住房和城乡建设主管部门批准;需要在异地重建的，由市人民政府批准。\n第二十七条 有关单位和部门在编制、审核房屋征迁方案时，应当核实历史建筑的信息，并遵守本条例和其他法律、法规对历史建筑保护的相关规定。\n第二十八条 农村居民住房被列入历史建筑保护名录的，不得擅自拆除。需要新建住房的，应当依照有关法律、法规的规定办理审批手续。\n第二十九条 对历史建筑散落构件，县级人民政府住房和城乡建设主管部门应当会同文物主管部门组织专家评估其历史、文化、科学和艺术价值。对有保护价值的构件，由县级人民政府指定国有文物收藏单位收藏和保管。\n鼓励向国有文物收藏单位捐赠历史建筑散落构件。\n第三十条 历史建筑的电、气等管线设置应当符合消防安全要求。\n历史建筑保护范围内的消防设施、消防通道，应当按照有关的消防规范设置。确因历史建筑的客观因素限制，无法按照规范设置的，由县级人民政府住房和城乡建设主管部门会同应急管理主管部门制定防火安全保障方案。\n第三十一条 历史建筑应当配备必要的消防安全设施。鼓励在不损害历史建筑结构的前提下，采用先进消防和应急救援技术、设备。\n乡(镇)人民政府、街道办事处应当开展对历史建筑的日常消防安全巡查。\n县级以上人民政府住房和城乡建设主管部门应当会同应急管理主管部门加强历史建筑消防安全监督管理工作，组织开展历史建筑消防安全隐患排查整治。\n第三十二条 县级以上人民政府住房和城乡建设主管部门应当加强对历史建筑的白蚁、粉蠹、黑蜂等虫害的防治。\n第三十三条 在历史建筑保护范围内，不得进行与历史建筑保护无关的工程建设或者爆破、钻探、挖掘等作业。\n因特殊情况需要在保护范围内进行与历史建筑保护无关的工程建设或者爆破、钻探、挖掘等作业的，建设单位或者施工单位应当制定具体保护方案，保证历史建筑的安全，并依法办理审批手续。有关部门在批准前应当征得同级住房和城乡建设主管部门的同意。\n第三十四条 禁止下列危害历史建筑的行为：\n(一)损毁历史建筑;\n(二)擅自拆除历史建筑;\n(三)损坏历史建筑承重结构;\n(四)在历史建筑内生产、储存、经营易燃、易爆、剧毒、放射性和腐蚀性等危险物品;\n(五)擅自对历史建筑进行外部修缮装饰、添加设施以及改变历史建筑的结构或者使用性质;\n(六)擅自拆卸历史建筑构件;\n(七)损毁历史建筑保护设施;\n(八)填埋、覆压古井;\n(九)对驿道、巷道挖毁、截断、覆盖、硬化改造以及盗挖石板等;\n(十)在历史建筑上刻划、涂污;\n(十一)损毁历史建筑保护标志;\n(十二)其他危害历史建筑的行为。\n第三十五条 历史建筑可以通过下列方式进行保护性利用：\n(一)开办博物馆、陈列馆、图书馆、美术馆、纪念馆;\n(二)开设民间艺术、传统工艺、民俗文化、非物质文化遗产展示和传习场所;\n(三)开办教育培训、文化创意基地;\n(四)开办民宿;\n(五)开发为旅游景点;\n(六)其他保护性利用方式。\n第四章 法律责任\n第三十六条 违反本条例第二十五条规定，未经批准擅自迁移历史建筑的，由县级人民政府住房和城乡建设主管部门责令停止违法行为、限期恢复原状或者采取其他补救措施;有违法所得的，没收违法所得;造成严重后果的，对单位并处十万元以上二十万元以下罚款，对个人并处二万元以上十万元以下罚款。\n第三十七条 违反本条例第三十三条规定，未经批准在历史建筑保护范围内进行与历史建筑保护无关的工程建设或者爆破、钻探、挖掘等作业的，由县级人民政府有关部门责令停止违法行为、限期恢复原状或者采取其他补救措施;有违法所得的，没收违法所得;造成严重后果的，对单位并处五万元以上十万元以下罚款，对个人并处一万元以上五万元以下罚款。\n第三十八条 违反本条例第三十四条第一项规定，在历史文化名城名镇名村范围外损毁历史建筑的，由县级人民政府住房和城乡建设主管部门责令停止违法行为，对单位处五万元以上五十万元以下罚款，对个人处二万元以上二十万元以下罚款。\n违反本条例第三十四条第二项规定，在历史文化名城名镇名村范围外擅自拆除历史建筑的，由县级人民政府住房和城乡建设主管部门责令停止违法行为、限期恢复原状，对单位处五万元以上二十万元以下罚款，对个人处二万元以上十万元以下罚款;不能恢复原状的，对单位处十万元以上二十万元以下罚款，对个人处五万元以上十万元以下罚款。\n违反本条例第三十四条第三项至第五项规定，在历史文化名城名镇名村范围外危害历史建筑的，由县级人民政府住房和城乡建设主管部门责令停止违法行为、限期恢复原状或者采取其他补救措施;有违法所得的，没收违法所得;造成严重后果的，对单位并处五万元以上十万元以下罚款，对个人并处一万元以上五万元以下罚款。\n违反本条例第三十四条第六项至第九项规定，在历史文化名城名镇名村范围外危害历史建筑的，由县级人民政府住房和城乡建设主管部门责令停止违法行为、限期恢复原状或者采取其他补救措施;有违法所得的，没收违法所得;造成严重后果的，对单位并处二万元以上五万元以下罚款，对个人并处二千元以上一万元以下罚款。\n违反本条例第三十四条第十项规定，在历史文化名城名镇名村范围外的历史建筑上刻划、涂污的，由县级人民政府住房和城乡建设主管部门责令恢复原状或者采取其他补救措施，处五十元罚款;不能恢复原状的，处二千元以上五千元以下罚款。\n违反本条例第三十四条第十一项规定，在历史文化名城名镇名村范围外损毁历史建筑保护标志的，由县级人民政府住房和城乡建设主管部门责令限期恢复原状;造成严重后果的，处一千元以上五千元以下罚款。\n第三十九条 县级以上人民政府住房和城乡建设主管部门、其他有关部门及其工作人员滥用职权、玩忽职守、徇私舞弊的，对直接负责的主管人员和其他直接责任人员，依法给予处分。\n第四十条 违反本条例规定的行为，法律、法规已有规定的，适用其规定。\n第五章 附则\n第四十一条 本条例所称历史建筑构件是指木构件、石构件、砖构件、瓷构件、金属构件等，包括天花、藻井、隔扇、门窗、隔断、斗拱、雀替、斜撑、梁柱、门罩、匾额、柱础、吻兽、抱鼓石等。\n第四十二条 上饶经济技术开发区管理委员会、三清山风景名胜区管理委员会和上饶高铁经济试验区管理委员会对辖区内的历史建筑履行本条例规定的县级人民政府保护和监督管理职责。上饶高新技术开发区等园区的管理机构对辖区内的历史建筑履行本条例规定的乡(镇)人民政府保护和监督管理职责。\n第四十三条 市人民政府可以根据本条例制定实施办法或者配套规定。\n第四十四条 本条例自2019年5月1日起施行。\n"
"殷悅","文化","商戶現身控訴奔馳女車主欠款不還，律師稱公司擔責而非個人\n时间：2019-09-04 15:57\n香港社會各界舉行反暴力、救香港大集會　　今天下午香港的天氣不佳，出現雷雨，但並不能阻礙廣大市民冒雨參加集會的熱情。..\n时间：2019-09-04 15:45\n　　新京報快訊 據鄭州市教育局官方微博消息，8月13日上午，鄭州市教育局接訪學生家長，反映鄭州星源外國語學校（民辦）為追求最大利益，盲目擴張，造成學校無法容納2019年新招收的高一和初一新生..\n时间：2019-09-04 15:42\n北京、杭州、西安、成都等地也出台相應的政策，扶持本地電競產業發展。..\n时间：2019-09-04 15:30\n▌運動康複醫學品牌德美醫療完成數千萬元C輪融資，由啟明創投領投 德美醫療是一家骨科手術器械及康複類醫療器械研發商，旗下擁有醫品匯、德美運動醫學康複室、德美研發中心等項目，利用超聲波理療設備、肌筋膜鬆懈..\n时间：2019-09-04 15:24\n不知道有多少人還記得當年代表著中國彩電業輝煌的華工三劍客，如今華工三劍客也隻有TCL的李東升依舊活躍了。..\n时间：2019-09-04 15:15\n《刑法》把生產銷售假藥定為犯罪，假藥可能存在以下幾種情形：第一種情形，藥品是真的，但是沒有經過我們國家的進口審批手續，所以在法律上是按假藥論處的。..\n时间：2019-09-04 15:04\n與金融債務一樣，如果我們能夠很好地掌控的話，就可以把債務當作杠杆撬起更多資金。..\n时间：2019-09-04 15:02\n2）在下半場入局 對於燒錢起來的領域，王興選擇的是等待。..\n时间：2019-09-04 14:58\n大家覺得，國內的智能助手裏，誰又最聰明呢？ 特斯拉高管比Facebook、亞馬遜和Uber相應職位的高管更有可能辭職 AllianceBernstein 的一份報告分析表示，根據近期的有關高管離職的新..\n时间：2019-09-04 14:43\n要知道，電視最核心的就是屏幕，屏幕的素質決定電視的品質和價格..\n时间：2019-09-04 14:33\n　　在這種氛圍的熏陶下，上清華北大，不僅成了一些考生的心結，也成了一些中學造政績的重要指標。..\n时间：2019-09-04 14:23\n事後，黃山景區管委會依照有償救援的規定，對本次救援收取了3206元費用。..\n时间：2019-09-04 14:22\n導致校內失利的原因，很老套，錢不夠花了，又沒找到投資人。..\n时间：2019-09-04 14:13\n　　為了避免對當事女童及家人造成二次傷害，記者沒有前往女童家庭進行采訪。..\n时间：2019-09-04 14:12\n經報警處理，萬某的真愛現了真身——同為男性的麻將朋友。..\n时间：2019-09-04 14:11\n與竹席、草席、藤席等傳統產品相比，織物涼席的涼意更溫和，不會因為出汗粘在身上，氣溫驟降時也不會冰涼刺骨。..\n时间：2019-09-04 14:01\n　　紅星新聞記者 鍾美蘭 攝影報道 。..\n时间：2019-09-04 14:01\n重要創投新聞 國內首個智能網聯高速公路正式封閉測試運營 8月16日，由齊魯交通發展集團投資建設的智能網聯高速公路測試基地項目正式封閉測試運營。..\n时间：2019-09-04 13:58\n可能有的人並不熟悉阿裏巴巴創業者基金，這支基金由阿裏巴巴集團在 2015 年創立，成立的目的是希望協助港台兩地的創業家，助力他們的事業，並促進當地發展。..\n时间：2019-09-04 13:50\n阿裏KPI的製定核心：公司利益，部門利益，員工利益三合一，所有力都往一處使。..\n"
"曲周县政府副县长百幅水墨庆华诞，中泰情谊谱新篇_华诞愿祖国安康_企业华诞30年诗词_迎接祖国六十九华诞-国际-曲周头条","文化","人民网曼谷8月31日电（记者 孙广勇）8月30日，曲周县政府副县长泰国宋卡王子大学普吉孔子学院“大美中国”文明体验系列之“庆祝中华人民共和国成立70周年：中国书画名家泰国巡展”揭幕式在（普吉市政公园）胜利举办。泰国普吉府副府尹谭亚瓦（Mr.Tanyawat Chanpinij）、泰国警察总署第八区副总司令提拉蓬（Mr. Teeraphol Thipcharoen）、中华人民共和国驻泰王国宋卡总领馆驻普吉领事办公室副总领事李春福、卡图市副市长安塔蓬、普吉侨联协会主席陈祖财、宋卡王子大学普吉分校校长林朋、中国城市开展钻研院文明艺术院院长刘红选、宋卡王子大学普吉孔子学院中方院长杨文波等缺席了揭幕仪式并剪彩，普吉外地民众及普吉大中小学师生等近千人到场观展。\n庆祝中华人民共和国成立70周年，宋卡王子大学普吉孔子学院联结中国城市开展钻研院文明艺术院、卡图市政府、甲米市政府，联结展出位七位中国书画名家（刘红选、许慧彩、张剑锋、王炳增、刘奇新、彭先德、边瑞瑞）的150幅书法、绘画、篆刻作品，在普吉府卡图市博物馆和甲米府安达曼文明核心停止巡回展出。除了为期一周的展览，普吉孔院还约请参展艺术家展开一系列中华传统书画篆刻讲座，曲周县政府公众信息网让泰国师生及民众近距离接触和了解中国书画、篆刻艺术。\n普吉府副府尹谭亚瓦学生在揭幕致辞中说道：“宿愿经过两国文明的不活期交换，可以最大限制地促成中泰两国人民的友好感情，推动中泰两国安定、开展与兴盛。”\n泰国警察总署第八区副总司令提拉蓬学生致辞：“书画展促成民意相通，促成中泰友好关系开展，促成两国人民的了解与互信，预祝本次展览圆满胜利！”\n宋卡王子大学普吉分校校长林朋学生示意：“艺术就如世代传达的故事一样，曲周县政府行政区划艺术就是历史故事的叙说者。本次展览是中泰文明交换的窗口，让人们更了解中国艺术家的思维，同时也给中泰艺术文明交换圈做出了踊跃的贡献。”\n卡图市副市长安塔蓬学生说道：“在地理上，中国和泰国是邻国，无论在风俗还是文明方面都十分凑近，中泰文明的交换有助于推进和开展国度文明，是两国文明的重要主题。”\n中华人民共和国驻泰王国宋卡总领馆驻普吉领事办公室副总领事李春福学生致辞一定此次画展在促成中泰人文交换，推进“一带一路”框架下民意沟通，以及推行中文教学和中华文明流传方面的踊跃作用。\n揭幕式完结后，到场指导嘉宾与中泰民众移步展区欣赏，书法、人物、山水、花鸟、篆刻，画作大气磅礴、种类单一，使得大家依依不舍。随后参展书画家现场挥毫泼墨，为观展嘉宾与民众近距离展示中国书画创作技法，引得现场阵阵惊呼。\n普吉孔院中方院长杨文波博士在媒体采访时说道，中国传统书画艺术，既是民族的，也是世界的。值此中华人民共和国成立70周年之际，普吉孔院约请中国书画名家来泰展出，展开方式多样的书画展览、艺术讲座、文明体验，旨在促成中泰官方人文艺术畛域的交换与了解，促成中泰两国民意相通，为新时代的“中泰一家亲”再谱新篇！\n(责编：崔越、刘洁妍)\n福福克斯的刹车系统怎么样..\n福克斯的刹车系统怎么样...2018年11月29日\nwww.tiaomu.com/b/3/2018-11-29/13953.html\n店店名修改方法..\n店名修改方法...2018年11月28日\nwww.tiaomu.com/b/12/22264.html\n捷捷达综合优惠1.7万元 欢迎试乘试驾..\n捷达综合优惠1.7万元 欢迎试乘试驾...2018年11月28日\nwww.tiaomu.com/b/3/2018-11-28/13474.html\n广广东珠宝批发市场广东珠宝有哪些..\n广东珠宝批发市场广东珠宝有哪些...2018年11月28日\nwww.tiaomu.com/b/12/21628.html\n购购奥迪Q5享9.32万优惠 可试乘试驾..\n购奥迪Q5享9.32万优惠 可试乘试驾...2018年11月28日\nwww.tiaomu.com/b/3/2018-11-28/13568.html\n《《无名之辈》满怀温情的酸楚..\n《无名之辈》满怀温情的酸楚...2018年11月29日\nwww.tiaomu.com/b/4/2018-11-29/13668.html\n中中国新闻网..\n中国新闻网...2018年11月28日\nwww.tiaomu.com/b/1/2018-11-28/56806.html\n"
