title,category,content
"字有深情在","文化","王羲之·草书《执手帖》\n字有深情在\n苏小曼\n-\n1\n《执手帖》是一封温暖的手信，每次读到，都可以穿透时光，让人感知写信人流动在笔尖的情感。\n“不得执手，此恨何深。足下各自爱。数惠告，临书怅然。”\n不能够见面“执手”，心中多么的痛惜，只希望你好好爱自己啊，已收到好几封信，给你回这封信时，心中怅然。\n20个字，几乎是一个时代的情感共鸣。\n不能相见的忧伤，化作深深的祝愿，心弦里的怅然，是不变的思念。真切的情意，加上流动书法，字里也有相思。尤其是“临书怅然”，笔法由心，有着懊恼却无奈的心情。还好手帖依然可以到达对方的手里，或许半年之后，还能收到回信，纵然“此恨何深”？能知道对方的确在“自爱”，应该心情会安慰一点吧。\n我喜欢《执手帖》，便是爱这克制又绵密的情感，懊恼又不灰心的思念。\n赵子昂·行书《洛神赋》\n2\n美娟的心上人叫明书。美娟的父亲不同意他们一起。天下的大部分父亲刚开始都是不相信女婿这种物种是靠得住的。但是美娟不管，他跟父亲闹了好一段。后来，美娟的母亲实在看不下去，让家里的老人出来说话。\n说话的人，是美娟的奶奶。她说：“起初我也是不同意，后来，美娟给我看了明书送她的《洛神赋》手抄书法，字写得特别好。书法能看见人心。一个字写得这么好的人，人不会不好的。”\n美娟的父亲还是第一次看见明书的字，他默默的看了一会，放下了《洛神赋》，没有搭话。\n两年后，好多亲朋好友都收到“手帖”的婚礼请柬，每一封都是明书手写，每一位参加婚礼的人，都被这请柬惊艳到。人人都夸美娟的父亲好眼光，找的女婿好风雅。\n美娟是我的小姨，至今在他们的生活中，依然保持着“手帖”的生活。一个字写得好的人，人不会不好的。在美娟与明书的婚姻里，是被论证可信的。无论是伴侣还是朋友，字写得好的人，在我的人生经历里，大多都是品性温良且懂得生活的人。不得不说，一个讲究“字”的人，在生活里一定要是有仪式感的。\n《造境记》作者鱼山留言\n《民国清流》作者汪兆骞留言\n学者熊培云留言\n3\n慢书房有一本红色笔记本，每次沙龙结束，都会请分享的老师留给书店一句话。这似乎也算是嘉宾的“手帖”。留言或寄语或祝愿，或感慨，老师们写得认真，我们也看得高兴。假如这样的雅兴可以维持更久，三十年后再回首，那必定是绝美的回忆。\n电子时代的人与人之间，“字“在手写的层面的意义越来越轻。中学时代，男生告白的纸条，写的清朗俊秀的”我喜欢你“像是晴空万里的云朵，洁白温柔直入心怀。一封远方到来的情书，是一行一行一字一字的读着。那时的”字“是情意的寄托，那是的情，都倾注在字里。\n鹿茸哥本家大兄的书法\n4\n鹿茸师兄去淮安出差，遇见一位同宗同源的大哥。据说因此多喝了三壶白酒。那位许姓大哥带着酒劲回去之后，挥笔写下书法三张。然后拍照发来微信。鹿茸师兄说：酒太烈。大哥回：情更浓。\n这位许大哥是生意人，但一直写毛笔字。尽管应酬很多，但酒后必定要回去写书法。想来，他必定也是一位性情中人。与这样的人交朋友，也是很有趣的吧。\n5\n慢书房收有一套书法练习随行装，名为慢书包。是一款入门级的书法练习文创。我是”忠实“的用户，每日练习，期待成为一位写字的人。一天之中，那怕只有半小时的写字时间，也会觉得今日成了一件有意义的事，静下心来写字，是的确可以平缓焦急的内心，与读书，是有异曲同工之妙的。\n忙忙终日，愿有闲心，常练字\n如果你也喜欢，点击“阅读原文” 可以购买\n文丨苏小曼\n图片丨慢师傅\n编辑丨WEY LEAN 返回搜狐，查看更多\n"
"黄瓜营养失衡症状","文化","　　黄瓜缺氮植株矮小，叶脉和叶片淡黄或淡褐色，瓜条顶端尖细。黄瓜氮过量初期叶小有斑点叶片镶金边，严重时叶片焦枯。黄瓜缺磷整个植株发僵。磷过量下部叶片失绿。黄瓜缺钾叶片自下而上沿叶缘黄花，变褐坏死。缺钾叶片自下而上沿叶缘黄化，老叶叶尖出现失绿花斑并环死。黄瓜缺钙上位叶卷，叶脉间发黄。黄瓜缺镁老叶脉间失绿变黄。黄瓜缺铁新叶鲜黄色，铁过量上部叶片下卷。\n　　黄瓜缺硼，生长点叶萎缩枯死，叶片外卷畸形、叶缘黄，茎蔓发生龟裂，（有时果实发生龟裂），黄瓜硼过量基叶叶缘黄白。黄瓜缺钼叶片脉问失绿变黄，叶缘向上卷曲呈杯状，新叶出症状迟。黄瓜缺锌植株蹲座，顶芽生长受阻，叶片不规则．黄化，莲座状，叶片变黄，外卷，节间短，叶较硬。黄瓜缺锰中位叶变黄，叶脉仍绿。黄瓜锰过量基叶有斑点，叶脉变褐。\n"
"组图：李兰迪戴彩色发卡娇俏满分 明媚少女调皮比心胶原蛋白满满_高清图集_新浪网","文化","已收藏!\n您可通过新浪首页(www.sina.com.cn)顶部 “我的收藏”， 查看所有收藏过的文章。\n"
"孔雀大叫着，结果吵醒了正在睡觉的老虎，镜头记录画面-高清视频-在线观看-头条视频","文化","孔雀大叫着，结果吵醒了正在睡觉的老虎，镜头记录画面\n"
"國道4大車追撞成一團 釀1死1傷","文化","國道一號南下麻豆路段今（4）日清晨四點多發生一起重大連環車禍，一輛貨櫃車疑似先追撞前方的砂石車，之後失控打滑，再遭到後方貨櫃車、聯結車相繼撞上，造成一死一輕傷。這一起車禍讓國道麻豆以南路段，全線封閉七個小時後才終於通車。\n▼國道一號南下麻豆路發生貨車連環車禍。（段圖／東森新聞）\n凌晨在國道一號麻豆路段的車禍現場，黑暗中只見好幾部大車撞在一塊兒。\n救難人員來到現場，兩部車車身黏在一起，橫跨好幾個線道，外側車道還有一部車的車頭卡在輪子底下。\n▼警消人員趕到現場救援。（圖／東森新聞）\n麻豆消防分隊隊長廖鼎鈞：「我們抵達現場，現場疑似四輛大貨車相撞，現場有一名患者，由我們消防人員協助送醫，輕傷，另外一名目前夾在車上，明顯受困，身體已經變形。」\n天亮了，車禍現場讓人怵目驚心，邊坡護欄被撞到變形還佈滿刮痕，地上都是散落的零件，一旁與車身分離的車頭被撞扁，駕駛卡在裡面好久終於被救出來。\n另一台大貨車的車頭同樣也被撞到變形，從另一個角度看，好幾部大車發生撞擊後東倒西歪佔據了整個車道。\n肇事駕駛：「從外線這樣子開，慢慢的開，原本看得到前面的路，結果開一開，突然間看到前面一片白茫茫的，然後就踩煞車，往左線拉就撞上去啦。」\n這起車禍事發生在清晨4時20分，一輛貨櫃車疑似先追撞前方的砂石車，失控打滑後，遭後方貨櫃車、聯結車相繼撞上，造成貨櫃車車頭嚴重變形，駕駛當場死亡，還有一名司機受到輕傷。\n記者：「目前在現場等多久了，你們到的時候，看到的是什麼狀況？」\n受回堵影響的駕駛：「兩個多小時了，全線封閉啊。」\n看看車禍現場後方，回堵的車流已經看不到盡頭，這起重大車禍也讓國道南下全線封閉，車流回堵好幾公里。\n▼這起車禍讓國道南下全線封閉，車流嚴重回堵。（圖／東森新聞）\n（封面圖／東森新聞）\n"
"《百家讲坛》节目预告：《雍正十三年》下部（8月21日-9月5日）","文化","《百家讲坛》节目预告：《雍正十三年》下部（8月21日-9月5日）\nCCTV专区CCTV-10科教频道 来源：央视网2019年08月20日 14:00A-A+我要分享QQ空间新浪微博腾讯微博QQ微信人人网百度贴吧腾讯朋友开心网一键分享\n《雍正十三年》下部（ 16 ）雍正家事 9 月 5 日播出\n翻开中国古代的史书，记载了不少帝王的传奇般的爱情故事，他们有的为了红颜一笑，可以任由外戚干政，也有的为了抱得美人却最终丢了江山。\n而和这些帝王相比，素以勤政著称的雍正皇帝，似乎缺少了一份轰轰烈烈、缠绵悱恻的爱情。雍正是一个勤政的帝王，他既没有“一骑红尘妃子笑”、“在天愿作比翼鸟”的痴情，也没有“晚妆初了明肌雪，春殿嫔娥鱼贯列”的后宫。在位的十三年，雍正几乎都是在案前辛勤地批阅奏章，处理政务。\n如今，一些人津津乐道的所谓雍正的后宫生活，大多来源于近年影视剧的戏说。那么，在真实的历史中，雍正皇帝究竟有着怎样的家庭生活？他一生中最为钟爱的女人又是谁呢？中国政法大学林乾教授，为您精彩讲述系列节目《雍正十三年》下部第十六集《雍正家事》。\n"
"望亭镇华阳村苏锡路沿线绿化景观（水土保持）工程","文化","招标项目信息\n招标项目名称 望亭镇华阳村苏锡路沿线绿化景观（水土保持）工程\n招标人 苏州市相城区望亭镇华阳村村民委员会\n招标代理机构 苏州中海工程项目管理有限公司\n中标结果信息\n中标单位 苏州新区枫桥花木有限公司\n中标价格(元)\n3396923.24\n中标工期(天)\n30\n中标质量标准\n合格\n中标项目负责人\n李金良\n项目负责人资质等级\n资质证书编号\n公告信息\n备案日期 2019年9月3日\n"
"【2019国际会展业CEO峰会】西虹桥与会展业不得不说的故事-中国企业报道","文化","6月19日,2019国际会展业CEO上海峰会在上海市青浦区隆重开幕。全球会展行业大咖齐聚青浦朱家角,共赴一场国际会展业交流盛会。上海市人民政府副秘书长尚玉英、商务部服务贸易司司长冼国义、青浦区人民政府副区长彭一浩等出席开幕式并致辞。国际展览业协会(UFI)首席执行官贺庭凯发表主题演讲。\n上海市人民政府 副秘书长 尚玉英\n商务部服务贸易司 司长 冼国义\n上海市青浦区人民政府 副区长 彭一浩\n国际展览业协会(UFI)首席执行官 贺庭凯\n本届峰会以“变革与传承——中国会展业的未来十年”为主题,通过市场、政府及企业三个视角探讨中国会展业在新时期下的机遇与挑战。\n开幕式上,上海市会展行业协会与上海市青浦区人民政府、新加坡展览主办方和供应商协会、香港展览会议业协会、美国展览业研究中心等机构签署战略合作协议;同时,上海市会展行业协会还聘请16位国际会展业著名人士担任第二批“上海会展业国际顾问”;东浩兰生集团宣布成立上海会展产业股权投资基金。\n西虹桥商务区\n打造“会展之城”有量有质\n《2018上海会展业白皮书》显示,上海展馆展能全球第一,展览数量快速增长,国际化程度不断提高,2018年上海会展业相关产业收入超过1400亿元。2018年,首届中国国际进口博览会在国家会展中心(上海)举办。由于进口博览会和国家会展中心(上海)的特殊地位,青浦区成为唯一把会展业作为区级经济支柱产业的行政区。\n作为青浦区“大会展”产业的主要承载地、国家会展中心(上海)所在地、中国国际进口博览会和虹桥国际经贸论坛永久会址、上海市会展行业协会办公地,西虹桥商务区以创新模式,打通会展产业上下游“任督二脉”,形成会展内容溢出、消费溢出等诸多“会展+”,打造“会展之城”有量有质。\n峰会期间,西虹桥商务区作为合作伙伴,就会展产业发展情况进行推介。\n上海西虹桥商务开发有限公司副总经理 王锡璟\n1、会展产业链企业加速集聚\n截至目前,西虹桥商务区共引进会展及会展周边企业近百家。上海市会展行业协会等会展促进机构,百展堂、德汉会展科技等各类会展服务企业,上海国际广告节承办单位上海道仑文化传播有限公司,家博会和建博会主办方中贸美凯龙,汽车展主办方上海国际展览有限公司,以及绿地巴塞罗那会展公司和绿地汉诺威会展公司等会展主办企业纷纷落户西虹桥。形成会展场馆方、会展主办方和会展配套服务企业全产业链。\n2、让看展,不仅仅是看展\n众所周知,举办大型会展的前提是,要有联动运作的会展配套服务体系。西虹桥商务区以国家会展中心(上海)为依托,手握“生态+文化”特色王牌,带动会展关联服务业发展,真正实现会展消费溢出。目前,以洲际酒店、铂瑞酒店为代表的高端服务业集聚,以及虹馆、百老汇剧院、手工艺博览园、蟠龙古镇、宝龙文化艺术城等一批文化综合体项目的打造,正在完美配合“会展之城”的崛起。\n3、 让参展,不仅仅是参展\n依托会展主办方,西虹桥商务区与医药展、汽车展、广告节等展会主办方建立良好关系,争取优质项目落户,实现会展产业集聚和会展内容溢出。目前已与上海市广告协会达成合作意向,共同推进广告企业落户。此外,西虹桥商务区内国家会展中心(上海)及周边数百万方楼宇资源,为会展企业入驻和孵化提供了优质载体空间。不断优化营商环境,全面打响“一网通办”政务品牌,专业细致的服务,良好的政策环境,西虹桥商务区已为会展这朵“四叶草”,准备好了欣然绽放的“土壤”。\n"
"「特戰部隊」對決蔣萬安 吳怡農：我會成為讓他尊敬的對手","文化","〔記者楊淳卉／台北報導〕民進黨中執會今通過六個艱困區域選區立委徵召提名，其中徵召新系大老吳乃仁侄子吳怡農參選台北市第三選區（中山、松山）立委，對決現任國民黨立委蔣萬安，「雙帥對決」備受外界關注。吳怡農於提名記者會上表示，蔣萬安是他尊敬的對手，但是特戰部隊有一個精神就是「勇猛頑強」，他會成為讓蔣萬安也尊敬的對手。\n中執會今通過區域立委徵召提名，包括台北市第三選區（中山、松山）徵召吳怡農，第六選區（大安）徵召新人、律師謝佩芬；新竹縣第二選區徵召去年代表民進黨參選新竹縣長的鄭朝方；苗栗第二選區徵召前頭份鎮長徐定楨；台中市第五選區（北屯區、北區）徵召交大生醫工程系助理教授莊競程；連江縣徵召民進黨發言人李問，金門縣則不提名。\n吳怡農表示，他相信華爾街不缺一個吳怡農，但台灣需要更多投資家園的人，他選擇離開金融業舒適圈，現在選擇加入非常困難的選戰，無論是哪個選擇，他都是會義無反顧為台灣努力的人，為台灣盡一份心力。他過去累積很多政策經驗，但政治場域仍是新人，感謝民進黨給他這個機會。\n吳怡農說，他正式參選後，將展開請拜會之旅，很多民進黨和非民進黨前輩為國家努力付出及基層經營，他會一一向前輩學習；他將與相同理念的團體合作，面對中國無恐不入的壓力，台灣走到經濟轉型的關鍵時刻，必須匯集所有挺台灣的力量。\n吳怡農表示，蔣萬安是他尊敬的對手，但是特戰有一個精神就是「勇猛頑強」，他會成為讓蔣萬安也尊敬的對手。希望他們之間的競爭為松山、北松山未來發展創造正向辯論，他更期待和選民在花博公園運動、做伏地挺身，在富錦街喝杯咖啡，聽聽大家對松山、北松山的記憶和未來的想法，他也會向大家證明他是最好的選擇。\n李問表示，馬祖對民進黨是非常艱困選區，蔡總統2016年大選在馬祖得票率是16％，他參選代表民進黨不放棄爭取任何一位選民支持，不放棄保護每一個國民安全和生計，他身為台灣年輕人，也希望有機會全心為馬祖服務。莊競程表示，他相信這場選舉不是他個人選舉，而是台灣一同守護自由民主的選舉。台中北北屯長期被視為民進黨艱困選區，他一定全力以赴，翻轉北北屯。\n徐定楨表示，苗栗是非常艱困的選區，但看到其他年輕朋友都願意在最艱困選區參選，甚至到馬祖參選，他非常敬佩，他也沒有選擇戰場的權力。希望大家這次票投民進黨，如果票投國民黨，台灣就會變香港。\n鄭朝方表示，他落選新竹縣長後，仍深蹲基層，昨天提名小組仍希望他承擔，他認為這是非常沈重的臨為受命。在艱困選區一定要有不怕輸、不認輸的精神。在深蹲後的他會一起承擔，與所有朋友往前衝，也感謝羅文嘉和黨主席卓榮泰千呼萬喚，以及立院民進黨團總召柯建銘把地方的聲音帶到中央，讓大家知道新竹縣的艱困。\n謝佩芬說，她過去進入國安會工作，在外交和國安的耕耘，她希望貢獻自己一己之力，讓台灣走向國際，讓世界看見台灣。感謝民進黨的信任和託付，徵召她這個全新的新人，民進黨徵召的不是謝佩芬這個人，而是台灣新一代的服務世代，這也代表民進黨的包容，為台灣的未來對新的服務世代敞開大門。\n不用抽 不用搶 現在用APP看新聞 保證天天中獎　 點我下載APP　 按我看活動辦法\n"
"平谷区举办庆祝新中国成立70周年民间剪纸艺术展","文化","平谷区举办庆祝新中国成立70周年民间剪纸艺术展。（主办方供图）\n人民网北京9月4日电 （尹星云）昨天，“妙剪生花颂中华——平谷区庆祝新中国成立70周年民间剪纸艺术展”在北京骏隆文化艺术中心开幕。\n展览由平谷区委宣传部、区文联主办。200幅展出作品构图精美、主题深刻、寓意深远、特色鲜明，既有艺术形式的美，又有内容的魂，既是剪纸艺术家们用手中的生花妙剪，用传统的艺术形式，表达对祖国的挚爱、对家乡的情怀、对美好生活的憧憬，也是向新中国成立70周年的献礼。\n展出作品分为六大主题。光辉绽放主题主要反映伟大祖国70年的建设成就，反映家乡平谷的经济社会、城市发展、生态文明成果，反映百姓幸福甜美的生活；真情祝福主题表达对祖国的祝福，表达对人民福、禄、寿美好生活的祝愿；大美山川山水平谷主题描绘祖国的大好河山，描绘平谷优美自然风光，描绘平谷以“十六景”为主体的众多美色美景；文明之花主题反映社会主义核心价值观和诚信、友善、自强、互助的文明平谷人系列题材；平谷区域发展主题反映平谷整体发展定位、发展理念、工作方法和目标等。\n近年来，平谷区民间剪纸艺术有了长足进步，人才队伍不断壮大，基层基础不断巩固，艺术质量不断提升。\n活动的举办主要是为新中国成立70周年营造喜庆热烈的氛围，为平谷区剪纸爱好者搭建展示的平台，发现培养本土剪纸艺术家，激发广大市民对传统艺术的认知和热爱，推动区域剪纸艺术繁荣发展。\n"
"软文营销如何打破固化逻辑思维打开读者求知欲","文化","创作来源于现实，有的文学创作、软文撰写以及一些创意策划都来源于现实。一般来说具有高级水平的软文写作者是内心比较敏感、兴趣比较广泛、喜欢洞察生活中微小的事物的人。他们对体验和知识有着强烈的求知欲，并且很喜欢去发现别人身上有趣的东西并且是一个很好的倾听者。\n如果你对产品做一个软文撰写，首先你一定要知道这个产品的各种性能，需要全方位360度无死角的去审视这个东西。很多人会觉得这个产品有商家给的亮点，只需要凸显它的亮点就OK。\n当然OK，因为那是重点，我所说的在我们不了解这种产品的情况下，你要比其他人更能了解你要写的这个东西，别人不知道你知道这就会凸显你的“特殊知识”。\n其次，你需要去了解你的顾客。你对产品有清晰的认识之后，你需要去了解该产品要推荐给谁？也就是这个产品的受众人群。\n你要知道他们知道什么不知道什么；喜欢什么不喜欢什么。用什么样的方法去引诱消费者去浏览或者购买该产品。\n你了解了产品和用户，还有一个非常关键的就是你用怎样的方式把产品呈现给用户。简单的说，就是每个产品都有着一种本质，你需要探究该产品在用户的头脑中的本质是什么？要提取用户真正感兴趣的因素。\n以上是178软文网小编整理的软文创作的简单步骤，当你知道这些步骤之后，接下来就是考验人的软文创作能力了。\n软文创作能力来源于我们生活方方面面，我们需要从自己的认知中去提炼。\n软文创作是对认知的再整合。无论你要写什么都需要在你的脑子里先组织你自己的想法，然后把这些想法形成文字，然后对文字进行整合。下面我们来介绍一下软文能力创作修炼的技巧：\n01刻意练习，从生活的微小事物开始。\n很多事情都有一个习得的过程，刻意练习很重要。我们就拿一个桃子来说，我们可以以“桃子”单个词为中心进行拓展去描述这个词。\n譬如：桃子；水润的桃子；水润多汁的桃子；轻轻咬一口，桃子的汁水溢出……\n也就是说一个物体，你去描述它的特性，然后加上场景动作之后，更能增加它的画面感。可以多在生活中常实践和练习。\n02打破固化的逻辑思维\n在软文创作的时候最怕看到什么就是什么。我们还拿桃子举例，我们可以找到桃子的特性去对标与桃子相似的东西或者某一件事儿。\n特性关联：桃子是比较常见的一种水果，普普通通的水果，也可以水润多汁，富含营养，并有不少人喜欢。可以从平平常常的事儿、平平淡淡的生活、普通的爱情出发，平平淡淡也可能过得有爱、精致、有内涵。\n03认真写好第一句话。\n对于软文创作来说，如果没有人看就是失败的。所以第一句话很关键，需要记住第一句话的目的，第一句话的目的其实就是吸引读者去读第二句话，以此类推，用第二句话引诱用户去读下面的文章……\n当然，所有的技巧也好，构思也好，所有的这些都需要一定的沉淀，而这些东西的沉淀则需要一个人热爱生活、对生活充满好奇心，这样才能够发掘更贴合用户心意的产品本质。返回搜狐，查看更多\n"
"《林宛如老王小说》——完整版小说——(全文在线阅读)","文化","【完结版小说】《老王诊所》热门火爆小说免费版已上线！\n小说简述：小说《老王诊所》，是最近的一部火热小说,目前已完结。\n搜索关注【二次阅读1】这个微丨信公丨众号|\n回复:【100】，即可免费阅读全文章节。\n第11话 免费\n第12话 免费\n第13话 免费\n......\n凰网科技讯，8月23日据路透社报道:\n看着华如花一边说着一边就在那里解开xiong前扣子的模样，老王不由得吞了一口口水。\n华如花虽然四十多岁了，可是保养得还真的没的说，尤其是xiong前那扣子解开的一瞬间，那两个白嫩的皮球都要蹦出来一般。\n只是刚才他已经把所有的力气都用完了，现在对方就是再怎么诱惑对他来说也是有些索然无味。\n“如花大妹子，这可是大白天啊，你店里的生意不做了？”\n老王吞口水的动作自然是没有逃过华如花的眼睛，当即咯咯咯的媚笑道“我那生意做不做都一样，倒是你一把年纪了还在这里跟我装绅士，，想要就直说，妹子我也是守寡多年的人，这么多年我还是第一次主动跟人表白的，错过这个村可就没这个店了。”\n说完这话，华如花便朝着老王扑去，还没等靠近，老王便眉头一皱躲开了。\n对方身上那浓郁的香水味让他有些受不了，尤其是跟刚才林婉如身上那种天然的体香一比，简直就是一个天上一个地下。\n“如花大妹子，我还不想找老伴，要找我也想找个年轻的，最起码能跟我生孩子。”\n老王这话听在华如花的耳朵里是那么的刺耳。\n她都这么主动了，居然还被一个老男人给拒绝了，脸上当即便挂不住了。\n“行，你可别后悔，你都是萝卜干了还想找水萝卜，简直就是做梦，你不喜欢老娘，旁边那几个卖鞋的可是一直对老娘穷追猛打的。”\n说完，华如花直接拿起两杯绿豆粥便扭着丰腴的腰肢快步离去了。\n看到对方离去的身影，老王心中一点也不后悔，因为他感觉人生有了新的目标，新的希望。\n【完结版小说】《老王诊所》热门火爆小说免费版已上线！\n小说简述：小说《老王诊所》，是最近的一部火热小说,目前已完结。\n搜索关注【二次阅读1】这个微丨信公丨众号|\n回复:【100】，即可免费阅读全文章节。\n"
