数据源,title,content
网站,Protest likely to greet Trump fundraising trip in California,"RIO RANCHO, N.M. (AP) — President Donald Trump is making a rare visit to California, a Democratic stronghold where he is expected to rake in millions of dollars during a series of fundraisers for his reelection effort that are almost certain to be met with jeering protests.Trump has routinely mocked California over its liberal culture, policies and politics. His visit Tuesday and Wednesday signals that despite the state's decidedly leftward swing in recent years there are still plenty of wealthy Republicans who support him.""There's not been a president in living history that is as unpopular in the state of California as Trump,"" said Mike Madrid, a GOP political consultant who is an outspoken Trump critic. ""But our money spends the same as everyone else's.""Trump continues to rake in gobs of cash more than a year out from the November 2020 contest, with his campaign and the Republican National Committee pulling in over $210 million since the start of 2019, Federal Election Commission records show. That's more than all the current Democrats seeking to replace him raised combined during that period.The California events, which will be spread across two days in in the Bay Area, Los Angeles and San Diego, are expected to bring in an additional $15 million, according to a Republican official familiar with the plans who spoke on condition of anonymity to discuss internal matters.California was an incubator for the modern conservative movement that swept the state's former governor, Ronald Reagan, into the White House in 1980. But demographic changes and an influx of new residents have helped drastically rework the political contours of the country's most populated state, with the former GOP stronghold of Orange County now home to more registered Democrats than Republicans. For Republicans, who have been resigned to political irrelevance at the state level, a donation to Trump can amount to its own form of protest.""By showing up to a fundraiser deep in the belly of the beast, one is saying: 'I don't care what the liberal politicians are saying and I want to show my support for him publicly,'"" said California's Republican National Committeewoman Harmeet Dhillon, who is an ardent Trump supporter. She added: ""I sold $100,000 worth of (tickets), and I could have sold another $100,000 more.""California has long been a key fundraising hotbed for politicians of both parties, which have relied on the entertainment industry and wealthy industry heads to finance their political ambitions. But under Trump, the run-of-the-mill fundraising trip has taken on a complicating dimension due to his harsh criticism of everything from the state's immigration laws to its forest management practices, which he blamed for fatal wildfires.Earlier this month Trump lashed out at ""Will and Grace"" TV star Debra Messing after she tweeted that attendees of the Trump's California fundraisers should be outed publicly.""I have not forgotten that when it was announced that I was going to do The Apprentice, and when it then became a big hit, helping NBC's failed lineup greatly, @DebraMessing came up to me at an Upfront & profusely thanked me, even calling me ""Sir."" How times have changed!"" Trump tweeted.In August, he took aim at the state's massive film industry, calling Hollywood ""very dangerous for our country.""""Hollywood is really terrible. You talk about racist — Hollywood is racist,"" he said.That's contributed to heightened security concerns surrounding the trip.You have run out of free stories. To continue reading, take advantage of our LOWEST offer yet!Already a subscriber? Log in orActivate your account.Loading&hellp;{{title}}{{start_at_rate}}{{format_dollars}}{{start_price}}{{format_cents}}{{term}}{{promotional_format_dollars}}{{promotional_price}}{{promotional_format_cents}} {{term}}{{html}}Thanks for being a subscriber.Sorry, your subscription does not include this content.Please call 877-525-6397 to upgrade your subscription.You have free articles remaining.Become a MemberThanks for reading.Subscribe orlog in to continue.{{featured_button_text}}Trump has also complained about the extent of homelessness in California. Housing and Urban Development Secretary Ben Carson is expected to follow Trump to California, if one day behind him, on visits to San Francisco, Los Angeles and San Diego. A senior HUD official said Carson will speak on a range of issues, including increasing the supply of affordable housing and incentivizing investment in distressed communities while protecting vulnerable neighbors.Already, the Backbone Campaign, a Washington state-based progressive group, said on Facebook that it planned to fly a large ""Baby Trump"" balloon in the Bay Area when Trump is scheduled to be there on Tuesday.In an unusual move, Trump campaign officials — not his top donors — have been listed as sponsors of the event.Dhillon said there were concerns that Antifa, an anti-fascist group, could stir violent protests.""For every person coming to this event, there would probably be 10 more,"" she said.Get Breaking News delivered directly to you.Sign up now for our Breaking News email!* I understand and agree that registration on or use of this site constitutes agreement to its user agreement and privacy policy.Trump began his three-day trip to the West at a rally in New Mexico, which he hopes to win next year despite losing by about 8 percentage points in 2016.Trump referred to California a couple of times in his speech, and not in a good way.The president noted that his administration is at odds with the state over fuel efficiency standards for automobiles. He long has made clear he wants to end California's clout in setting mileage standards, and Monday night he said he wants heavier cars because they're safer and cheaper, even if they are less fuel efficient.""California wants you to do the other cars and we don't,"" Trump said. ""We will end up in big litigation and I am fighting for you,"" he told the crowd.He also joked about moving part of the border wall in San Diego to where it would be more appreciated.""I would love to take that sucker down and move it right now to New Mexico,"" he said to rousing cheers.———Slodysko reported from Washington. Associated Press writer Zeke Miller in Washington contributed to this report.Coming soon: Get Government & Politics updates in your inbox!Stay up-to-date on the latest in local and national government and political topics with our newsletter.* I understand and agree that registration on or use of this site constitutes agreement to its user agreement and privacy policy."
网站,Trump to visit Mexico border for groundbreaking,"7:50 HRS ISTBy Lalit K JhaWashington, Dec 27 (PTI) US President Donald Trump has said that he plans to visit the country's southwestern border with Mexico early next year for groundbreaking.Trump has made securing the southern border a focal point of his presidency, with plans to beef up border security and create a wall as key components.In an interaction with reporters during his surprise visit to Iraq with First Lady Melania, Trump said he wants to visit the border wall before the State of the Union Address next year.This is his first visit to Iraq as the US President.Trump said he is planning on ""going to the wall"" on the Southwest Border of the US early next year for a ""groundbreaking"".Trump made these remarks while taking questions from reporters during a briefing with US military leaders shortly after landing in Iraq.Trump indicated that he will not budge from his position on border wall. With the opposition Democrats refusing to approve the necessary funds, the federal government has been under a partial government shutdown for four days now.""Whatever it takes. We need a wall. We need safety for our country. Even from this standpoint. We have terrorists coming in through the southern border,"" Trump said when asked how long this shutdown would last."
网站,"Trump, Warren host massive rallies -- but 'anybody' can get Warren's crowds, Trump insists","closeVideoCan Trump flip New Mexico from blue to red in 2020?The Trump campaign says the key is winning over Hispanic voters in a state that hasn't been red since 2004.President Trump and Democratic contender Elizabeth Warren hosted dueling rallies on Monday that attracted massive crowds, setting off a war of words between the two candidates that underscored rising national enthusiasm heading into the 2020 election.Thousands of people packed under the marble arch of Manhattan's Washington Square Park to hear Warren, and her campaign estimated the attendance at 20,000-plus. Staffers also said that more than 5,000 people heard their candidate last week in Austin -- despite thunderstorms blowing in earlier in the day.But speaking to reporters on Tuesday, Trump said of Warren's New York crowd, ""Anybody can do that.""""No. 1, she didn't have 20,000 people,"" the president said. ""And No. 2, I think anybody would get a good crowd there.""Attendees at Trump's rally, meanwhile, took up every seat at the 7,500-capacity Santa Ana Star Center in suburban Albuquerque, with throngs gathered in an overflow area outside. People lined up 13 hours in advance of the rally, and traffic around the arena was snarled, according to local reports.Trump, Warren attract massive crowds in dueling ralliesThousands of people packed under the marble arch of Manhattan's Washington Square Park to hear Warren, while more than 15,000 reportedly saw Trump in New Mexico.Local officials estimated that up to 15,000 people showed up to the rally in the Democratic-leaning state, which Trump lost by 8 points in the 2016 presidential election.The president is trying to turn New Mexico red as part of an aggressive new campaign strategy. Trump's first visit to the Land of Enchantment as president drew visitors from Colorado, California and all parts of New Mexico, according to local media.And Trump campaign officials said a campaign rally in nearby El Paso, Texas, last February was well attended by female and Hispanic voters and travelers from New Mexico, further suggesting that New Mexico is in play.Trump is looking to find the next Wisconsin or Michigan — states that Democrats generally win in presidential elections but that can surprise under certain conditions, as they did in 2016. Also on the Trump team's shortlist: Nevada, New Hampshire and Minnesota.Enthusiasm was apparent as the president touted New Mexico's economic successes and demanded the resignations of senior leadership at The New York Times following the paper's botched publication of a misleading accusation against Supreme Court Justice Brett Kavanaugh. Attendees enthusiastically chanted in response, ""Four more years!""“This is New Mexico. A lot of people in New Mexico really like Trump because he’s fighting for them,” an attendee told local station KRQE-13.For Warren, attracting her own large crowd without the benefit of incumbency took special effort.President Donald Trump arrives to speak at a campaign rally at the Santa Ana Star Center, Monday, Sept. 16, 2019, in Rio Rancho, N.M. (AP Photo/Evan Vucci)The crowd was the product of a carefully planned, data-driven strategy to identify supporters, attract them to a rally and ultimately convert them into voters, a plan that goes well beyond producing a compelling scene for television.In an era where campaigns increasingly try to leverage technology to tactical advantage, the attention to detail by Warren's team stood out among her Democratic rivals.Like other candidates, her campaign invited past donors and other likely supporters who live nearby using email, mass text alerts and ""peer-to-peer"" text messages written by staffers before the event.But that's just the start. At the venue itself, attendees must line up and check in using their phones, even if they've previously RSVP'd. When finished, they're sent a picture of the senator's Golden Retriever, Bailey, which they show at the door to be issued a red-dot sticker proving they've complied.Warren's campaign spent months testing how best to collect information, trying out methods like different colors of paper signup sheets before settling on the current system since attendees get a doggie picture they're likely to enjoy.Democratic presidential candidate U.S. Sen. Elizabeth Warren takes the stage before addressing supporters at a rally, Monday, Sept. 16, 2019, in New York. (AP Photo/Craig Ruttle)""It's efficient but also fun,"" said Tessa Simonds, the Warren campaign's director of grassroots mobilization.Warren has mastered the art of drawing thousands to her rallies, but, more importantly, those turning out are also a proxy for her recent rise in the polls. And the crowds have been building for weeks in places that have received relatively little attention from other candidates, including Seattle and Minneapolis.In 2016, the enormous crowds who flocked to see Bernie Sanders were an early sign of the enthusiasm that would build around his campaign and lead him to nearly defeat Hillary Clinton for the Democratic nomination. This cycle, Sanders and other Democrats have also staged large rallies, but it is Warren who seems to hold the energy edge.Trump's large crowds four years ago hinted at his coming Election Day upset. Similarly, Barack Obama was still largely unknown nationally when he launched his presidential bid in 2007 — yet demonstrated his early strength by drawing 20,000 at a Super Bowl Sunday rally in Delaware.""When you get a big crowd and reporters are covering that and they're like, 'Wow, there's a lot of energy in the room,' ... that can absolutely get you free earned media,"" said Brendan Steinhauser, a Republican strategist and former top, conservative grassroots organizer. ""And if we learned anything from 2016, earned media is really valuable and can — pardon the pun — trump the paid media.""Democratic presidential candidate U.S. Sen. Elizabeth Warren addresses supporters at a rally at Washington Square Park, Monday, Sept. 16, 2019, in New York. (AP Photo/Craig Ruttle)At the same time, big crowds aren't everything. Many Democrats bitterly remember throngs watching Clinton, Bruce Springsteen and Jon Bon Jovi in front of Philadelphia's Independence Hall the night before Trump's 2016 victory. Democrat Walter Mondale attracted massive 1984 crowds in New York and Boston days before losing 49 out of 50 states (including New York and Massachusetts) to President Ronald Reagan.That's because large rallies can show enthusiasm, but often aren't good indicators of whether support is growing beyond a candidate's established base. The people who show up to such events tend to be self-selecting.""It's all reinforcing, the data, plus the visuals on TV feed more people in the crowds,"" said Joe Trippi, former campaign manager for Howard Dean, who organized early rallies large enough to briefly become a 2004 Democratic front-runner.But when voting began, it became clear that the former Vermont governor was more effective at building ballyhooed crowds than winning votes.""The issue is going to be, all that buzz on television and online, and the resources that it gets you, does that expand beyond that base support?"" Trippi asked. ""In the Dean campaign, it didn't. In Obama's it did.""Supporters of President Donald Trump cheer as he arrives to speak at a campaign rally at the Santa Ana Star Center, Monday, Sept. 16, 2019, in Rio Rancho, N.M. (AP Photo/Evan Vucci)Judging crowd size is subjective, meanwhile, and can be so politically charged that police sometimes refuse to offer official estimates.Warren's campaign says its crowd-size estimates partially come from staffers and volunteers using counting clickers to gauge the number of attendees.The Warren campaign won't discuss its ""targeting"" of would-be supporters, nor would it touch analytical components like how many people it has on nationwide donor, volunteer or supporter lists. Aides concede they hope anyone invited to rallies will increase turnout by bringing friends, neighbors or relatives, but refuse to quantify how many new attendees such scenarios tend to generate.Still, attracting the crowd is only the beginning.Warren volunteers are trained as ""canvassers,"" asking event attendees to rank their top three Democratic presidential primary choices. The campaign won't say if it treats people leaning toward other candidates differently from avowed Warren supporters.Betting many will like what they see, Warren staffers follow up with rally-goers quickly, issuing text or email solicitations for donations or future volunteering — sometimes during or immediately after the event.In states where Warren's campaign has lots of staffers, like Iowa, large teams of organizers can easily make follow-up contact. In other places, including Austin, staff based at Warren's Boston headquarters travel to the area beforehand, hoping to convert rally attendees into future volunteers.Warren has become known for spending hours after each event taking ""selfies"" with attendees — and her staffers and volunteers work those lines, too, looking for future volunteers or people willing to try to recruit friends and neighbors to be supporters.Trump generally keeps a tighter schedule at his rallies. The president stayed in New Mexico on Monday night, then flew to the San Francisco Bay area on Tuesday for a luncheon fundraiser. He is expected to attend a fundraising dinner in the evening in Beverly Hills at the home of real estate developer Geoffrey Palmer.He has two more fundraisers planned in Los Angeles and San Diego on Wednesday.The fundraisers in left-wing strongholds will benefit Trump Victory, the joint entity that funds Trump's reelection campaign and the Republican National Committee.Fox News' Alex Pappas and The Associated Press contributed to this report."
网站,Australian PM to meet Trump,"Australian PM to meet Trump, visit NASA during US trip … reports Asian Lite NewsAustralian Prime Minister Scott Morriso.(File Photo: IANS)Australian Prime Minister Scott Morrison announced on Monday that will leave for an official trip to the US on Thursday where will meet President Donald Trump at the White House and also visit the NASA headquarters.Morrison and his wife, Jenny, will visit Washington D.C, Chicago, Ohio and New York from Thursday to September 27, the Nine News Network reported.The Prime Minister’s itinerary includes a State Dinner at the White House, the trip to NASA headquarters and meetings with Australian tech entrepreneurs.“It was an honour to accept President Trump’s generous invitation for an official visit with a State Dinner at the White House,” Morrison said in a statement.“I look forward to meeting again with President Trump and members of his Cabinet, including Vice President (Mike) Pence, Secretary of State (Mike) Pompeo and Secretary of Defence (Mark)Esper to discuss how we can further strengthen our alliance and already close partnership.”Morrison said the visit will be a valuable opportunity to further strengthen the security and economic partnership of both countries.“There is no deeper friendship than that which exists between Australia and the US,” he added.It was reported that Trump will join Morrison also in Ohio for a tour of a new Australian-owned paper recycling mill after the White House State Dinner."
网站,Trump gives California grief - but also likes its money,"PORTOLA VALLEY, Calif. (AP) — President Donald Trump rarely passes up the chance to throw a sharp elbow at left-leaning California, but he showed Tuesday he's more than happy to cash in there with a lunch-dinner-breakfast-lunch fundraising blitz expected to scoop up $15 million from wealthy Republicans in two days.""There's not been a president in living history that is as unpopular in the state of California as Trump,"" said Mike Madrid, a GOP political consultant who is an outspoken Trump critic. ""But our money spends the same as everyone else's.""With protesters not far away, Trump kicked off his moneymaking Tuesday with a $3 million Bay Area luncheon, to be followed by a $5 million Beverly Hills dinner at the home of real estate developer Geoffrey Palmer. He'll bring in an additional $7 million on Wednesday with a breakfast in Los Angeles and luncheon in San Diego.About 100 protesters lined the road about a mile from Trump's luncheon site in Portola Valley, with demonstrators inflating giant Baby Trump and Trump Chicken balloons.Trump, for his part, tweeted a cheery message as he departed New Mexico on Tuesday to fly to the state: ""Just departed New Mexico for California, where we are delivering results!"" The tweet included statistics about the state's unemployment rate and job creation.Talking to reporters aboard Air Force One, Trump got in some fresh digs about the state's problem with homelessness, saying, ""We can't let Los Angeles, San Francisco and numerous other cities destroy themselves by allowing what's happening.""""The people of San Francisco are fed up, and the people of Los Angeles are fed up. And we're looking at it, and we'll be doing something about it,"" he added.Los Angeles Mayor Eric Garcetti, a Democrat, said ahead of Trump's arrival that he hoped the president would work with the city to end homelessness. He said he had not been invited to meet with the president.California was an incubator for the modern conservative movement that swept the state's former governor, Ronald Reagan, into the White House in 1980. But demographic changes and an influx of new residents have helped drastically rework the political contours of the country's most populated state, with the former GOP stronghold of Orange County now home to more registered Democrats than Republicans.For Republicans, who have been resigned to political irrelevance at the state level, a donation to Trump can amount to its own form of protest.""By showing up to a fundraiser deep in the belly of the beast, one is saying: 'I don't care what the liberal politicians are saying and I want to show my support for him publicly,'"" said California's Republican National Committeewoman Harmeet Dhillon, an ardent Trump supporter.She added: ""I sold $100,000 worth of (tickets), and I could have sold another $100,000 more.""California has long been a key fundraising hotbed for politicians of both parties, which have relied on the entertainment industry and wealthy industry heads to finance their political ambitions. But under Trump, the run-of-the-mill fundraising trip has taken on a complicating dimension because of his harsh criticism of the state's immigration laws and its forest management practices, which he blamed for fatal wildfires.Earlier this month Trump lashed out at ""Will and Grace"" TV star Debra Messing after she tweeted that attendees of the Trump's California fundraisers should be outed publicly.Trump tweeted back: ""I have not forgotten that when it was announced that I was going to do The Apprentice, and when it then became a big hit, helping NBC's failed lineup greatly, @DebraMessing came up to me at an Upfront & profusely thanked me, even calling me ""Sir."" How times have changed!""In August, Trump took aim at the state's massive film industry, calling Hollywood ""very dangerous for our country.""""Hollywood is really terrible. You talk about racist — Hollywood is racist,"" he said.That's contributed to heightened security concerns surrounding the president's visit.Overall, Trump continues to rake in gobs of cash more than a year out from the November 2020 contest, with his campaign and the Republican National Committee pulling in more than $210 million since the start of 2019, Federal Election Commission records show. That's more than all the current Democrats seeking to replace him raised combined during that period.The visit this week marks Trump's fourth visit to the state during his presidency. Housing and Urban Development Secretary Ben Carson is expected to follow Trump to California, one day behind the president, with visits to San Francisco, Los Angeles and San Diego. A senior HUD official said Carson would speak on a range of issues, including increasing the supply of affordable housing and promoting investment in distressed communities.———Slodysko reported from Washington. Associated Press writer Zeke Miller in Washington contributed to this report."
网站,Trump Not Ready to Visit North Korea,"In comments Monday to reporters, President Trump said that he is ?not ready? to visit North Korea to hold direct talks with Kim Jong Un. He declined to elaborate beyond that.Trump was asked about this because South Korean media reported that in his August letter, Kim had invited Trump to visit Pyongyang, which would?ve potentially been a chance to get the denuclearization talks restarted.Even though Trump and Kim had once said they were willing to visit one anothers? countries, Pyongyang apparently is not where the next stage is happening. While the US has said they are very interested in more talks, there is as yet no plan on going anywhere specific.That Trump had last met Kim in the demilitarized zone of Korea likely lent itself to the suggestion Pyongyang might be on the table. Trump has suggested he hopes for talks by the end of the year, but has provided no indication where he might be comfortable having them.Author: Jason DitzJason Ditz is news editor of Antiwar.com. View all posts by Jason Ditz"
