数据源,title,content
网站,"Trump update 9/16/2019..President Donald Trump Rally LIVE in Rio Rancho, New Mexico","President Trump in Rio Rancho, New MexicoPresident Trump Delivers Remarks Upon Departure for Rio RanchoTrump presents the Medal of Freedom to Mariano RiveraIn a short while I will be presenting the New York@Yankees@MarianoRivera, the greatest relief pitcher (Closer!) of all time, with the Presidential Medal of Freedom in the East Room of the@WhiteHouse!— Donald J. Trump (@realDonaldTrump) September 16, 2019Crown Prince Salman Bin Hamad Al Khalifa visits the White House amid Trump’s push for an international pressure campaign against Iran.Trump says Iran appears to be behind Saudi strikeRemember when Iran shot down a drone, saying knowingly that it was in their “airspace” when, in fact, it was nowhere close. They stuck strongly to that story knowing that it was a very big lie. Now they say that they had nothing to do with the attack on Saudi Arabia. We’ll see?— Donald J. Trump (@realDonaldTrump) September 16, 2019Because we have done so well with Energy over the last few years (thank you, Mr. President!), we are a net Energy Exporter, & now the Number One Energy Producer in the World. We don’t need Middle Eastern Oil & Gas, & in fact have very few tankers there, but will help our Allies!— Donald J. Trump (@realDonaldTrump) September 16, 2019CNN’s Erin Burnett speaks with Rep. Ilhan Omar (D-MN) about President Donald Trump’s history of issuing threats to foreign powers and not following through, amid threats made to Iran after an attack on Saudi Arabia oil facilitiesWill the Saudi oil attack push China to the negotiating table?Producer prices in China shrank most in 3 years due to China’s big devaluation of their currency, coupled with monetary stimulus. Federal Reserve not watching? Will Fed ever get into the game? Dollar strongest EVER! Really bad for exports. No Inflation…Highest Interest Rates…— Donald J. Trump (@realDonaldTrump) September 16, 2019…The United States, because of the Federal Reserve, is paying a MUCH higher Interest Rate than other competing countries. They can’t believe how lucky they are that Jay Powell & the Fed don’t have a clue. And now, on top of it all, the Oil hit. Big Interest Rate Drop, Stimulus!— Donald J. Trump (@realDonaldTrump) September 16, 2019Michael Pillsbury predicts China trade deal will be ‘monumental’Trump on GM strike: Nobody is better to auto workers than mePUTTING YOUR TAX DOLLARS TO WORK: DEMS WANT TO IMPEACH TRUMP“Democrats would rather talk about gun control than get something done.” Governor John Sununu@FoxNews@BillHemmer The big questions are, will they “move the goalposts” and, is this just a ploy to TAKE YOUR GUNS AWAY? I hope NOT on both counts, but I’ll be able to figure it out!— Donald J. Trump (@realDonaldTrump) September 16, 2019They failed on the Mueller Report, they failed on Robert Mueller’s testimony, they failed on everything else, so now the Democrats are trying to build a case that I enrich myself by being President. Good idea, except I will, and have always expected to, lose BILLIONS of DOLLARS..— Donald J. Trump (@realDonaldTrump) September 16, 2019….for the privilege of being your President – and doing the best job that has been done in many decades. I am far beyond somebody paying for a hotel room for the evening, or filling up a gas tank at an airport I do not own. These Radical Left Democrats are CRAZY! Obama Netflix?— Donald J. Trump (@realDonaldTrump) September 16, 2019Targeting of the Trump Campaign is the Worst Criminal Conspiracy in AMERICAN HISTORY!House Judiciary has given up on the Mueller Report, sadly for them after two years and $40,000,000 spent – ZERO COLLUSION, ZERO OBSTRUCTION. So they say, OK, lets look at everything else, and all of the deals that “Trump” has done over his lifetime. But it doesn’t….— Donald J. Trump (@realDonaldTrump) September 16, 2019….work that way. I have a better idea. Look at the Obama Book Deal, or the ridiculous Netflix deal. Then look at all the deals made by the Dems in Congress, the “Congressional Slush Fund,” and lastly the IG Reports. Take a look at them. Those investigations would be over FAST!— Donald J. Trump (@realDonaldTrump) September 16, 2019CNN Blames Trump Supporters For Fact Checking Them??! How Does That Even Make SenseSeñorita _Donald Trump and Vladimir PutinTrump blasts the New York Times over its Kavanaugh story“The New York Times walks back report on Kavanaugh assault claim.”@foxandfriends The one who is actually being assaulted is Justice Kavanaugh – Assaulted by lies and Fake News! This is all about the LameStream Media working with their partner, the Dems.— Donald J. Trump (@realDonaldTrump) September 16, 2019“What’s happening to Justice Kavanaugh is a disgrace. This guy is not a good man, he is a great man. He has to go to his church with his family while these terrible reports are being written about him, a disgrace!” Dan Bongino@foxandfriends— Donald J. Trump (@realDonaldTrump) September 16, 2019Just Out: “Kavanaugh accuser doesn’t recall incident.”@foxandfriends DO YOU BELIEVE WHAT THESE HORRIBLE PEOPLE WILL DO OR SAY. They are looking to destroy, and influence his opinions – but played the game badly. They should be sued!— Donald J. Trump (@realDonaldTrump) September 16, 2019The@nytimes. “This week, the Senate passed a milestone in confirming the 150th Federal Judge of Mr. Trump’s Administration to a lifetime appointment, far outstripping Barack Obama’s pace and fulfilling pledges by Mr. Trump and Mr. O’Connell to remake the Federal Judiciary….— Donald J. Trump (@realDonaldTrump) September 16, 2019…..’These Conservative Judicial appointments will impact our nation for years to come,’ said Lindsey Graham, Republican of South Carolina, who leads the Judiciary Committee and who has been speeding through Trump nominees.” The entire Court System is changing at a record pace!— Donald J. Trump (@realDonaldTrump) September 16, 2019Source:"
网站,Trump is the swamp,"Foreign governments, Republican PACs and congressional Republicans are spending millions at Trump's hotel in Washington. AG Barr decides to have a party at the same hotel, the tab being $30,000.VP Mike Pence chooses to stay at a Trump resort 180 miles from his conference in Dublin. It appears that the entire hotel was booked for Pence at taxpayer expense.Now the military is involved. At least one supply mission from Alaska to Kuwait, which normally stops at military bases in Europe to refuel, was redirected to a private airport in Scotland a dozen miles away from Trump's golf resort. The crews were directed to stay at the resort.These are not isolated incidents, but a pattern of greed that is a clear violation of the emoluments clause of the Constitution. The guy's a crook, and he's making patsies out of his supporters. The sooner he's gone, the better.Richard KeslinkeAlgonquin"
网站,Trump to Meet With Leaders of India and Australia,"President Trump will travel to Texas next weekend to attend an event with India’s prime ministerPresident Trump will travel to Texas next weekend to attend an event with India’s prime minister and then will visit Ohio with Australia’s leader.President Trump will travel to Texas next weekend to attend an event with India’s prime minister and then will visit Ohio with Australia’s leader, the White House said.Mr. Trump will join Indian Prime Minister Narendra Modi at a community...Read more: The Wall Street JournalYou mean the same idiot that is weaponizing space to compensate for his build? Strange world we have arrived at and it will get scarier, then pause, and then sanity will be voted in. Bet on it. Is Indian PM Narendra Modi, an Ape, is so important that US President Donald Trump will himself travel to Texas to meet him! OMG.Trump will insult him also and please don't come to Houston. Mass shooting follow Trump. A straight fwd person, Man of principles POTUS is entertaining Butcher of Gujrat! a person who is responsible for genocides of Kashmiri people in the occupied Kashmir. violated UN resolutions, human rights violations.coming world order? Literally, 2 most powerful ppl and coming world order Relations between US & India is building up very strong, hope this is for good...!Taliban Negotiators Meet With Russian Officials After Trump Ends Talks Taliban representatives have held talks with Russian officials in an apparent effort to restart discussions with the U.S., days after President Trump declared negotiations with the insurgent group dead. DESTROY THE TALIBAN! Is Russia doing the delivery of money for Trump in order to help Trump getting Iran to the negotiating table? We don’t negotiate with terrorists...Parents of American who died after return from North Korea to meet Trump NEW: The parents of Otto Warmbier, the 22-year-old American student who died shortly after being brought back from North Korea, will dine at the White House with Pres. Trump. will it be Mickey Ds or KFC?the world awaits with bated breath Well done steaks with ketchup for all! Why would they ever want to do this? After all the praise he is had for the man that has their sons death. I just don’t understand itTrump says U.S. ‘locked and loaded’ after attack on Saudi oil Trump said the United States was “locked and loaded” following a drone attack on a major Saudi Arabian oil facility, which the Trump administration is blaming on Iran Yeah... Fire & Fury style... sTaBLeGeNiUs *Apocalypse, Now? App* “No self-respecting authoritarian should leave home without it. “ MBS realDonaldTrumpTrump rebuffs Kavanaugh impeachment calls after new sexual misconduct report U.S. President Donald Trump rejected Democrats' calls for impeaching Suprem... There are already documents, emails from his Bush era service, that prove he lied to Congress under oath when he was screened for his previous federal judgeship. Disgusting behavior by current lawmakers threatening Federal Judges with impeachment without evidence and accusations of lies again without evidence. If only squee.Gun control must include background checks, Dems tell Trump WASHINGTON (AP) — Congressional Democratic leaders warned President Donald Trump on Sunday that any proposal on gun control must include a House-passed bill to expand background checks for gun... Here comes the pain for those who voted for Kavanaugh, like Susan Collins of Maine; this’s the prob with seating a Sup Court Justice in a viciously partisan manner without thorough vetting process; the truth eventually comes out. This’s McConnell’s legacy Already a background check to by a gun. Democrats have nothing to stand on. They're a joke and their demands should be ignored. In fact they should be treated like children who don't get what they want.Trump says his DOJ should 'rescue' Brett Kavanaugh President Donald Trump called on his Justice Department Sunday to 'rescue' Supreme Court Justice Brett Kavanaugh after The New York Times published an excerpt of a new book detailing sexual misconduct allegations against Kavanaugh that he has previously denied. 'Save the peon my slaves... I can't loose face over this... wait my fly is undone...' Trump doesn’t know how things work. If the event occurred, should Kavanaugh not be accusing his friends of assault since they pushed his penis into her hand? And it seems only the “witness” has memory of this event - maybe “misremembering” his own event?"
网站,Kim invites Trump to Pyongyang,"President Donald Trump and North Korean leader Kim Jong Un: an invitation to PyongyangNorth Korean leader Kim Jong Un invited U.S. President Donald Trump to visit Pyongyang in a letter sent in August, a South Korean newspaper reported on Monday, citing diplomatic sources.The letter, the second Trump received from Kim last month amid stalled denuclearization talks between the two countries, pre-dated North Korea’s latest launch of short-range projectiles a week ago.In the second letter, which was passed to Trump in the third week of August, Kim spoke of his willingness to meet Trump for another summit, one source reportedly told the Joongang Ilbo newspaper.The White House, the U.S. State Department and the North Korean mission to the United Nations all did not immediately respond to requests for comment.Trump and Kim have met three times since June last year to discuss ways to resolve a crisis over North Korea’s missile and nuclear programs, but substantive progress has been scant.The pair last met at the Demilitarised Zone (DMZ) between the two Koreas in June and agreed to restart working-level negotiations that had been stalled since an unsuccessful second summit between the two leaders in Vietnam in February.Last week’s round of short-range missiles came just hours after Vice Foreign Minister Choe Son Hui said North Korea was willing to have “comprehensive discussions” late this month.Trump subsequently said he would be willing to meet Kim at some point later this year.Trump said on Aug. 9 he had received a three-page “very beautiful letter” from Kim and added he could have another meeting with himShare this:TweetMore"
网站,Trump’s coming to the Bay Area this week. So is the gigantic Baby Trump balloon. Trump’s coming to the Bay Area this week. So is the gigantic Baby Trump balloon.,"President Donald Trump is coming to the Bay Area on Tuesday morning, which means activists with the Backbone Campaign need to get their helium ready.As part of a conga line of protests being organized against the president’s rare fundraising visit, cloaked in secrecy but possibly taking place in the tony Peninsula enclave of Atherton, the Backboners have raised more than $3,000 on Facebook to launch a gigantic baby-Trump-in-diapers balloon near his events in the Bay Area and, later, in San Diego.Other anti-Trump groups are planning protests in a part of Northern California that the president considers enemy territory. But the Backbone Campaign folks are taking a decidedly saucy and irreverent approach to show their displeasure with the man in the White House.“President Trump is coming to CA on September 17th and 18th, and we’re going to show him that he is not welcome here,” according to a Facebook fundraising page set up by the Seattle area-based group, whose self-described mission is to “amplify the aspirations of ‘We the People’ with creative strategies and artful activism to manifest a world where life, community, nature, and our obligations to future generations are honored as sacred.”Here are some things to know about the group and its artful aspirations:Who are they?Created in 2003 by Seattle activist Bill Moyer, the Backbone Campaign espouses a theory and practice of “artful activism,” in which performing-arts tenets are melded with political strategies to spawn nonviolent social change. Moyer and his colleagues have created and produced hundreds of creative protests, including demonstrations that feature spotlights to project political messages onto the sides of buildings.How did it start?Moyer co-founded the Backbone Campaign with “friends from an artist affinity group,” according to its website. “He has dual and intersecting paths as both an activist and artist. His involvement with social change work stretches back to the 80’s, when as a student he was deeply involved in the anti-nuclear movement and the anti-interventionist movement.” Moyer has studied political science and American philosophy, worked with members of the Navajo Nation on land issues, attended the Institute for Social Ecology, and lived for while on an organic vegetable farm in Vermont.What’s their message?The group’s motto says it all: “When the people lead, the leaders follow.” And it says it’s working “across the country to build a broad social movement that honors life, community, nature, and our obligations to future generations as sacred.”What’s the group’s plan during Trump’s Bay Area visit?The Backbone Campaign says it wants to mobilize its “Baby Trump” balloon to fly during the president’s visits in both the Bay Area and San Diego. “This means we need to raise money for helium (which is the single biggest expense) and transportation costs! We are estimating to do both days this will cost us approx $4800 (which will also cover a bit of our organizational overhead costs),” the group said on a Facebook fundraising page. “All donations help! Whether it’s $1, $5, or $100, it all adds up, and help to get the Baby into the air!”Where will they fly the Baby Trump balloon?“We have heard that the Bay Area event will be in the town of Atherton, just slightly northwest of Menlo Park, and south of Redwood City,” the group also said on the Facebook fundraising page, even though Atherton police have said that that plan has changed and it’s unclear where the president will be Tuesday. “We do not know an exact location yet, but it is a ‘luncheon’ so it will likely happen sometime between 10am and 2pm. After this event he will be heading to Beverley Hills for dinner, and will likely spend the night in LA before heading to San Diego in the morning.“We have little information about the San Diego event,” said the group, “but news media seems to think that there will be some kind of public event apart from the fundraiser, possibly related to the Border Patrol or the Wall. If he plans to go to the Border or meet with Border Patrol, then we will fly baby Trump down there. If he goes to visit a military base, then we will plan to fly it outside the base.”How much money have they raised so far for the balloon?As of Monday morning, the group has raised $3,842 from 163 people in 14 days — enough, they say, for the helium they need to send the balloon skyward.What is their goal?Since the Backbone Campaign is a 501(c)(3) organization, they say they “cannot engage in partisan politics, or support or endorse any candidate or party. This also means we cannot directly interfere with candidates or parties that are raising money, as this will threaten our tax-exempt status. So, as a non-profit, non-partisan organization we want to make it clear that Backbone is not, and cannot, protest the RNC and the Trump Campaign.”The group said on the Facebook fundraising page that it plans “to have the Baby set up close by, but not directly in front of the fundraiser entrance (but there is nothing stopping any individual from moving closer to the fundraiser). If Trump’s only appearance in San Diego is at the RNC fundraiser then the Baby, like the Bay Area event, will need to remain a block or two away from the fundraiser entrance to not give the appearance of directly protesting the RNC.”What are some of the props they use to beef up their protests?The group’s site includes these protest props: “Guerrilla Light Projection, Overpass Light Brigade LED Panels, Giant Overpass Banners,Giant 2D & 3D Imagery, Papier-mache Puppets, Helium-assisted Banner Lifts”So what exactly is the point of the Baby Trump balloon?“This is a protest against the President of the United States, and his Administration,” says the Backbone Campaign on the Facebook fundraising page, which criticizes the president as “a complete buffoon who has made this nation the laughing stock of the world.” They demand that Trump resign and ask Vice President Mike Pence to do so as well."
网站,Trump ramps up rhetoric on Iran,"Trump has hinted at the potential for military action in the wake of the attacks on two Saudi oil sites and also referred back to Iran’s role in shooting down a U.S. military drone in June, an event that ramped up already high tensions between Washington and Tehran.ADVERTISEMENT“Remember when Iran shot down a drone, saying knowingly that it was in their ‘airspace’ when, in fact, it was nowhere close,” Trump tweeted Monday.“They stuck strongly to that story knowing that it was a very big lie. Now they say that they had nothing to do with the attack on Saudi Arabia. We’ll see?”His comments come a day after Trump tweeted that the U.S. was “locked and loaded” after the attack but was waiting on Saudi Arabia to verify who was responsible. Trump didn’t mention Iran explicitly but said the U.S. has “reason to believe that we know the culprit.”Iran has denied involvement in the attacks. Meanwhile, Iranian-backed Houthi rebels in Yemen have claimed responsibility for the attacks and threatened further strikes in Saudi Arabia.The Saudi-led military coalition said Monday that preliminary evidence indicates that the weapons used in the attack were Iranian and that the drone strikes did not originate from Yemen.The developments have thwarted any potential for a meeting between Trump and Iranian President Hassan Rouhani at the upcoming United Nations General Assembly in New York City, with Iran’s foreign ministry dismissing the possibility early Monday.Saturday's attacks on the oil facilities, which are run by state-owned Saudi Aramco, shut down roughly 5 percent of the global oil supply and sent prices skyrocketing.The attacks have dominated the president’s Twitter feed over the last few days.Trump spoke with Saudi Crown Prince Mohammed bin Salman by phone on Sunday to offer U.S. support for Saudi Arabia’s self-defense. Later, Trump said he would authorize the release of oil from the Strategic Petroleum Reserve if necessary in order to keep markets well-supplied.Reports have suggested the Trump administration is weighing a serious military response to the attack, though it’s unclear what, if any, action the president will ultimately take. Trump is poised to depart for a campaign rally in New Mexico later Monday, and then to California for fundraisers before returning to D.C. on Wednesday.Trump’s tweets have harkened back to his rhetoric after Iran shot down the U.S. military drone in June. Trump approved airstrikes against Iran following the drone incident but said he called them off at the last minute after being told it would lead to more than 100 casualties, saying the U.S. had been “cocked and loaded” to retaliate.Trump has increased economic sanctions on Iran following his withdrawal from the Obama-era pact between six countries and Iran meant to restrain Tehran’s nuclear program, and tensions have worsened in recent months following the downing of the U.S. drone.Still, Trump has appeared more open to meeting with Iran to potentially ease the confrontation. Some also suspected the administration’s rhetoric on Iran may soften following the ouster of White House national security adviser John BoltonJohn BoltonLiz Cheney says world is more stable, 'safer' under TrumpBolton exit provokes questions about Trump shift on IranTrump needs a national security adviser who 'speaks softly'MORElast week.Trump had acknowledged the possibility of a meeting with Rouhani, telling reporters in recent weeks that “anything is possible” and expressing optimism that Iran is willing to reach some kind of agreement.Trump last week didn’t rule out easing sanctions on Iran in order to meet with Rouhani, something Iran has said would need to happen in order for him to agree to a meeting.“We’ll see what happens,” Trump told reporters when asked during an Oval Office meeting on e-cigarettes if he would consider easing sanctions to make a meeting happen.“I think Iran has a tremendous, tremendous potential,” Trump continued. “They’re incredible people. They have — we’re not looking for regime change. We hope that we can make a deal, and if we can’t make a deal, that’s fine too, OK? That’s fine too. But I think they have to make a deal. They’ve never been in this condition.”On Sunday, Trump denied he was willing to meet with Rouhani without conditions, contradicting past statements by Pompeo and other administration officials that Trump would not set preconditions for such a meeting."
