数据源,title,content
网站,Trump gets amnesia on Iran,"But Trump seems to now have amnesia about it,tweeting Sunday, ""The Fake News is saying that I am willing to meet with Iran, 'No Conditions.' That is an incorrect statement (as usual!).""Get our weekly newsletterSign up for CNN Opinion's new newsletter.Join us on Twitter and FacebookTrump has a history of sending mixed messages regarding his intentions toward Iran. After the Iranians shot down a US drone in June, hetweeted, ""Iran made a very big mistake!"" Trump approved retaliatory strikes against Iranian missile batteries and radars and then abruptly called off the operation.In recent weeks Trump has made conciliatory statements about the Iranians. Earlier this month, Trumpsaid he could be open to meeting with Rouhani at the UN General Assembly in New York, which begins next week.Trump's recently departed national security adviser, John Bolton -- long an advocate for regime change in Iran -- opposed a suggestion from Trump that he might support lifting some of the sanctions against Iran,according to The Washington Post. This disagreement was one of the reasons for Bolton's ouster from the White House last week.Monday, a spokesman for the Iranian Foreign Ministry said there wasno possibility of a meeting between Rouhani and Trump at the General Assembly.President's foreign policy in shamblesTrump's foreign policy agenda is now largely in shambles. The much-vaunted dealmaker has seen his negotiations with the North Koreans over their nuclear program fizzle and yield scant tangible results. Trump abruptly ended negotiations with the Taliban this month. Trump's trade negotiations with the Chinese seem to be at an impasse and the possibility of an Israeli-Palestinian peace deal on his watch is close to zero.Iran is turning up the heat against the Saudis as well as the United States following the re-imposition of US sanctions against the Iranians by the Trump administration last year. The new round of US sanctions has more than halved Iran'soil exports, its key revenue source.The Iranian Islamic Revolutionary Guard Corps and its elite Quds Forces and Iranian proxies around the Middle East arefighting back to signal their anger with the Trump-imposed sanctions.The Trump administration has blamed Iran for Saturday's attack against key Saudi oil facilities thatdisrupted around half the country's oil capacity.Ramping up the ""maximum pressure"" campaign on the Iranians has helped lead to Saturday's serious attack on the Saudis, a close US ally, which has put global oil markets into a tailspin and simultaneously ramped up the possibility of a wider regional war. Art of the Deal, indeed.The Iranians havedenied responsibility for Saturday's attack, which is their routine response when they or their proxies carry out attacks in the region.President Trumptweeted Sunday that the United States is ""locked and loaded depending on verification"" of who was behind Saturday's attack in Saudi Arabia.The negotiated pathSo what will happen between Trump and Iran? Negotiations are vastly preferable to a war. And that seems to be Trump's natural inclination.The President sent additional troops to Afghanistan only reluctantly in 2017 and was pursuing a withdrawal agreement with the Taliban until he abruptly canceled the negotiations earlier this month. At the end of 2018, he said he was going to pull all US troops out of Syria, precipitating the resignation of the secretary of defense, Jim Mattis. Trump has gone from threatening ""fire and fury"" on the North Koreans to declaring his ""love"" for Kim Jong Un.Now Trump has only an acting national security adviser in place to coordinate the range of military and diplomatic courses of action he might choose from to retaliate against Iran at a time when he has his first genuine foreign policy crisis to deal with.Does anyone know what Trump's achievable end goals are with Iran, including the President himself?"
网站,What Is the Trump Doctrine?,"The most accurate measure of a man is who he counts as his friends and who he counts as his enemies. John Bolton has a lot of friends and allies in the American national security community, myself included. When Bolton resigned from the national security adviser’s job, the fastest praise for his defenestration came from Iran, Russia, and Sen. Rand Paul.A spokesman for the Tehran kakistocracy said, “John Bolton had promised months ago that Iran would last for another three months. We are still standing and he is gone. With the expulsion of the biggest proponent of war and economic terrorism, the White House will face fewer obstacles in understanding Iran’s realities.”Russia’s Deputy Foreign Minister Sergei Ryabkov said, with a wink and a nod, that he had “no expectation” that relations between Russia and the U.S. would improve “immediately.”Perhaps their view was best summarized by isolationist-libertarian Rand Paul, who said that the threat of war is much lower with Bolton out of the White House. In that he was, as is not unusual, categorically wrong.Bolton is certainly a hawk, which means that he takes strong opposition to the aggression of other nations — such as Iran — and is wary of America’s adversaries including Russia, China, Iran, North Korea, and a bunch of lesser powers.But to call Bolton a neocon interventionist is inaccurate as well. Being wary, suspicious, and altogether realistic about our enemies is not equivalent to wanting to start a war with one or all of them.The question going forward, no matter whom Trump picks for his fourth national security adviser, is: What coherent set of ideas is the president pursuing in foreign policy? Is there a “Trump Doctrine,” or is there only a “let’s make a deal” transactional policy that only sometimes coincides with America’s interests?Great leaders set their doctrines clearly in stated policy. Ronald Reagan said America’s mission was to “nourish and defend freedom and democracy.” He declared, “We must stand by our democratic allies. And we must not break faith with those who are risking their lives — on every continent, from Afghanistan to Nicaragua — to defy Soviet-supported aggression and secure rights which have been ours from birth.” He added, “Support for freedom fighters is self-defense.”From that clear statement of America’s interests — and the derivative “peace through strength” motto — came diplomacy, economic and military competition, collaboration with heroes such as Poland’s Lech Wałęsa, and the fall of the Soviet Union.Trump has made no such statement of foreign or military policy. His actions have been all over the map.In a press conference with Russian President Vladimir Putin, Trump was asked whether he believed our intelligence community or Putin on the subject of Russia’s interference in the 2016 election. He said he gave equal credence to them both. More recently, he has advocated that Russia should be readmitted to the G7, from which it has been thrown out because of its conquest of Crimea.On the other hand, Trump has imposed some severe economic sanctions on Russia.Trump boldly traveled to Korea to meet with Kim Jong Un, North Korea’s absolute ruler. Perhaps as a result, North Korea has ceased long-range missile tests as well as nuclear tests. (It’s more likely true that the Norks’ nuclear test site at Punggye-ri has collapsed the mountain above it, making it unusable.) But there is no foreseeable agreement with the Norks for them to give up their nuclear weapons and accept inspections of their nuclear and ICBM sites. Nevertheless, Trump has proclaimed that he and Kim have fallen in love with each other.We saw the proposed Camp David summit with Taliban leaders get canceled after the Taliban killed the fourth U.S. soldier in two weeks. That “summit” was the product of a yearlong negotiation that didn’t produce an agreement, only the outline of one. And those negotiations were held without even a demand by Trump that the Taliban agree to a cease-fire before the talks could begin.Bolton reportedly resigned over the proposed Taliban Camp David summit and because the president said he wanted to relieve Iran of some of the economic sanctions he’d imposed against it. Both were enormously bad ideas.Trump’s economic sanctions have brought the Iranian economy to the brink of ruin, despite France’s and Germany’s efforts to sustain it. But Trump may, at any time, meet with Iranian President Hassan Rouhani without preconditions.From these actions, we can conclude that Trump enjoys violating the normal practices of diplomacy, a tactic that in and of itself is perfectly fine. But we have to further conclude that his eagerness to make deals overcomes his dealmaking skill.By continuing to cozy up with Putin, Trump is leading Americans and our allies astray. He apparently doesn’t understand that an essential part of his job as leader of the free world is speaking clearly about America’s interests and how others such as Putin, Kim, Rouhani, and China’s Xi Jinping are working relentlessly against them.How can our allies take seriously the fact that Putin, for example, is our enemy when the president is so eager to embrace Putin? How can the American people understand how important our opposition to Putin, Kim, Rouhani, and Xi is without presidential clarity on that issue?Simply put, they can’t. Thus, our European allies are making themselves dependent on Russian gas supplies. They are working hard to trade with Iran to evade our sanctions and scolding us for Trump’s tariff war with China. Americans, in the rare moment when they even think about those issues, must be convinced that we aren’t seriously threatened by Putin, Kim, Rouhani, and Xi, among others. The president is the only person who can do that, but he refrains from doing so.Trump’s doctrine, if there is one, almost resembles that of Henry John Temple, Lord Palmerston, who served during the reign of Queen Victoria.In 1848, Lord Palmerston told the British parliament, “We have no eternal allies, and we have no perpetual enemies. Our interests are eternal, and those interests it is our duty to follow.”There is one huge difference between Palmerston’s approach to Germany at the time of Russian aggression and, for example, Trump’s agreeing to a summit with the Taliban. Palmerston had a clear vision of Britain’s interests in the ever-changing balance of power between nations. Trump, who seems to grasp at virtually any deal, apparently doesn’t have nearly as clear an understanding of America’s interests.In making any deal, whether it’s a commercial real estate deal or a negotiation with an international adversary, both sides use every bit of leverage they have to gain the best agreement they can. When Trump gave equal credence to our intelligence agencies and Putin, he surrendered the leverage the intelligence agencies gave him. He gained nothing and lost every ounce of leverage they had given him. By agreeing to negotiations with the Taliban — far less a summit — without a cease-fire, he gave up what little leverage we have left in Afghanistan.The loss of John Bolton from Trump’s team removes Bolton’s balancing influence on Trump. Secretary of State Mike Pompeo apparently doesn’t press the president to avoid obvious errors as Bolton did in opposing the proposed Taliban summit and, certainly, many other issues. Trump is going to do what he wants to do.This week, after Tuesday’s elections in Israel, Trump may unveil the political half of his proposed “deal of the century” between the Israelis and the Palestinians. The economic part of the deal, which offered billions in economic aid to the Palestinians, was already rejected by them.Any “land for peace” exchange in the political half of the deal has already been effectively rejected by Israeli Prime Minister Benjamin Netanyahu. Netanyahu has said Israel will annex much of the West Bank territory if he is re-elected and said Trump has agreed with it. In short, there’s no reason to believe that Trump’s proposed deal will be accepted by either side.Americans, our allies, and our enemies still don’t know just what the “Trump Doctrine” may be. If the president studied more of what Lord Palmerston said and meant in his many speeches and spent a weekend at Camp David with Henry Kissinger, perhaps he could decide just what it is."
网站,Trump rally Rio Rancho: Trump touted what he has done for NM economy,"CLOSEFrom border security to NAFTA, here are some highlights from Trump's speechCONNECTTWEETLINKEDINCOMMENTEMAILMORERIO RANCHO, N.M. — President Donald Trump started his campaign speech at the Santa Ana Star Center in Rio Rancho by bragging about the job growth and New Mexico's economy.“We are united by the same love of our great country and, by the way, our country is doing great,” Trump said after greeting the crowd.He then spoke for a little more than an hour and a half on topics ranging from border security and the economy to media coverage and the upcoming election.“We will campaign for every vote and we will win the great state of New Mexico,” he said, garnering cheers from the crowd.He highlighted booming oil and natural gas industries.“We have ended the last administration’s war on American energy,” Trump said.He said natural gas production in New Mexico has increased 40 percent under his leadership and crude oil has nearly doubled. He said the increased natural gas production means better wages and more jobs.“You’re doing better than any state in the United States,” Trump said. “How do I lose New Mexico? Explain that one.”Trump hopes to win New Mexico in 2020Trump visited New Mexico in hopes that he can win the state after losing it in 2016. Hillary Clinton received 385,234 votes — a little more than 48 percent of the votes cast in New Mexico — in 2016 while Trump received 319,667 votes, or approximately 40 percent. Libertarian candidate Gary Johnson received 74,541 votes.Buy PhotoIt didn't take long for the Santa Ana Star Center to start filling up once the doors opened.(Photo: Hannah Grover/The Daily Times)Twice the speech was interrupted by booing from someone in the crowd. Each time Trump’s supporters responded by cheering until they drowned out the sound of the protests.“You must never forget the 2020 election is about one thing. What’s it about? It’s about you,” Trump said toward the end of his speech.He added that the election is “about your family. It’s about your future and it’s about the fate of your country for your children, for everybody.”The president focused on Hispanic votersThroughout the speech, he routinely circled back to Hispanic American voters, even mentioning that it is Hispanic Heritage Month. He said his policies, such as border security, are especially important for Hispanic American voters.He said Democrats place the rights of undocumented immigrants above the rights of American citizens.“Right here in New Mexico, Democrats are trying to turn you into a total sanctuary state,” he said.He warned that if immigration laws are not enforced that violent criminals will be released onto the streets.Buy PhotoPresident Donald Trump's Communications Director Tim Murtaugh told reporters on Sept. 16, 2019 before the rally that Trump's campaign visit to New Mexico is a strategic move.(Photo: Hannah Grover/The Daily Times)“Republicans believe our cities should be sanctuaries for law-abiding Americans, not criminal aliens,” Trump said.He said border security is at the heart of the opioid epidemic in the United States because the cartels are bringing drugs, including fentanyl, into the United States.“Whether you’re a first generation or a tenth generation, every American citizen deserves a government that defends your jobs, your safety, your family and is always loyal to you,” Trump said. “Your politicians have not been loyal to you. They’ve been loyal to themselves.”He assured people at the rally that the border wall is being built and will be built in New Mexico.Trump says unemployment is decreasing for Native AmericansHe briefly touched on Native Americans as well when he said unemployment among Native Americans has reached the lowest point in nearly two decades.He also referred to Democratic presidential candidate Elizabeth Warren as Pocahontas and criticized her claim that she is part Native American.“I have more Indian blood than she does and I have none,” Trump said.Buy PhotoPresident Donald Trump speaks to the crowd at his campaign rally Sept. 16, 2019 in Rio Rancho.(Photo: Sam Ribakoff/The Daily Times)Warren has received backlash after using a genetic test to bolster her claim.Trump touts trade deal with Mexico, CanadaTrump said New Mexico was devastated by the North American Free Trade Agreement, also known as NAFTA. NAFTA was a trade agreement between the United States, Mexico and Canada that was signed by President Bill Clinton. Trump said NAFTA led to a loss of manufacturing jobs in New Mexico. He then touted a renegotiated trade agreement known as United States Mexico Canada Agreement, or USMCA. He said people can remember the acronym by thinking of the song “YMCA.”The agreement still needs to be ratified by Canada and approved by the U.S. Congress.Trump also criticized Democratic Party platforms on issues like late-term abortion and gun control. The crowd erupted in cheers when he said he would not infringe on citizens’ rights to bear arms.He also received cheers when he said the AIDS epidemic in the country will be gone in 10 years.Trump continues discussion about light bulbsLast week Trump announced he would be rolling back energy efficiency requirements scheduled to go into effect in January for light bulbs. The announcement got widespread attention after he said the energy efficient light bulbs make his skin look orange. He touched on that subject at the rally as well.""You pay less money and you look better,"" he said about light bulbs that don't meet the energy efficiency requirements that would have gone into effect.He said the energy-efficient light bulbs are also considered hazardous waste if they break.Senate candidate attends rallySenate candidate Mick Rich commented on how energetic the crowd was at the rally. He had come to the rally after visiting the New Mexico State Fair.He expressed support for Trump’s proposals and said the two things Trump focused on were the economy and border security. He described both of those as “promises made, promises kept.”Buy PhotoAt center, New Mexico Senator candidate Mick Rich talks with local leaders and business people, Thursday, Aug. 2, 2018 at San Juan College School of Energy in Farmington.(Photo: Jon Austria/The Daily Times)Rich said one of the big differences between campaigning at the rally and campaigning at the fair was that he was speaking to people across the political spectrum at the fair.Like Trump, Rich is trying to win a Republican victory as he campaigns for the senate seat being vacated by U.S. Sen. Tom Udall, D-NM.He said some people would hand his card back to him when he said he was a Republican. To that, he would respond “if we want to end the partisan divide in Washington, we have to vote for the person, not the party.”Hannah Grover covers government for The Daily Times. She can be reached at 505-564-4652 or via email at hgrover@daily-times.com.We want to keep you up-to-date during President Trump's visit to New Mexico. Please consider subscribing today and help us continue providing news that matters to you.CONNECTTWEETLINKEDINCOMMENTEMAILMORERead or Share this story: https://www.daily-times.com/story/news/politics/new-mexico/2019/09/16/donald-trump-rally-rio-rancho-new-mexico/2306328001/"
网站,President Donald Trump,"US president pays for an ‘all-American’ feast from McDonald’s, Wendy’s to celebrate Clemson TigersWASHINGTONPresident Donald Trumppersonally paid for an “all-American” feast of burgers, pizza and fries for a visiting college football champions as theWhite Housechefs are among those furloughed due to the partial government shutdown, the longest in the US history.On Monday, the Clemson Tigers were invited by Trump to the White House to celebrate their national championship win over the Alabama Crimson Tide. With the White House chefs staying home because of the shutdown, Trump used his own money to order burgers and fries from McDonald’s and the Wendy's, which he said were the “great American food.”“We ordered American fast food. Paid for by me. Lots of hamburgers, lots of pizza, I think they'd like it better than anything we could give,” Trump said.Standing behind the spread of fast food, in the Dining Room of the White House, Trump said, “I like it all. It's all good stuff, great American food. And it's going to be very interesting to see at the end of this evening how many are left.”“Because the Democrats refuse to negotiate on border security, much of the residence staff at the White House is furloughed so the President is personally paying for the event to be catered with some of everyone's favourite fast foods,” White House Press Secretary Sarah Sanders said.Thailandto deport model claiming Trump secretsABelarusian model who claimed she had proof of Russian efforts to helpDonald Trumpwin office was set to be deported after being convicted Tuesday nearly ayear after her arrest in Thailand for participating in a “sex training course”. Anastasia Vashukevich has been held with several others since a raid in Pattaya last February.She was embroiled in a scandal with Russian tycoon Oleg Deripaska, a former associate of Trump’s former campaign director Paul Manafort.APattaya court convicted her and seven co-defendants to three years, and $6,000 fines, but reduced the sentences to time served. Thai immigration chief Surachate Hakparn said they would be deported."
